name,note,state,ownership,waterfront,location,website,delta_temp,climate,elevation_feet
Medoc Mountain State Park Campground,,NC,state,none,"36.2458,-77.8927",,5.480819999999996,slightly warmer,190
Cary Campground,"Campground in Osceola National Forest in a pine flatwoods setting, not directly on a lake or river.",FL,federal,none,"30.4004,-81.9277",,16.306739999999998,much warmer,104
Nutbush Bridge Campground,Many sites are right on the beach.  Part of Kerr Lake State Recreation Area.,NC,state,lake,"36.4123,-78.3982",,4.572719999999997,slightly warmer,360
County Line Camping Area,Many campsites are located on the lakefront.  Part of Kerr Lake State Recreation Area.,NC,state,lake,"36.5202,-78.3199",,4.378499999999995,slightly warmer,360
Bullocksville Park,Many campsites are located on the lakefront.  Part of Kerr Lake State Recreation Area.,NC,state,lake,"36.4590,-78.3666",,4.488659999999995,slightly warmer,360
Kimball Point Campground,Many campsites are located on the lakefront.  Part of Kerr Lake State Recreation Area.,NC,state,lake,"36.5357,-78.3102",,4.409100000000003,slightly warmer,344
J C Cooper Campground,Many campsites are located on the lakefront.  Part of Kerr Lake State Recreation Area.,NC,state,lake,"36.4328,-78.3732",,4.55922,slightly warmer,354
Hibernia,Many campsites are located on the lakefront.  Part of Kerr Lake State Recreation Area.,VA,state,lake,"36.5102,-78.3700",,4.419900000000005,slightly warmer,354
Henderson Point Campground,Many campsites are located on the lakefront.  Part of Kerr Lake State Recreation Area.,VA,state,lake,"36.5350,-78.3459",,4.480560000000006,slightly warmer,324
Blue Knob State Park Campground,"Best sites according to www.youtube.com/watch?v=HhmVrsQAuR8: 1*, 16, 20, 21, 22**, 24, 26, 27, 28, 29, 43*, 45, 47, 48, 50*",PA,state,none,"40.2892,-78.5898",,-9.987300000000001,cooler,2486
Sleepy Creek WMA Camping Area,"WMA camping area near Sleepy Creek Lake, but sites are not confirmed to be directly on the lake shoreline.",WV,state,none,"39.5110,-78.1539",https://wvdnr.gov/lands-waters/wildlife-management-areas/,-3.894840000000005,similar,1171
Nathaniel Mountain WMA dispersed camping,Dispersed camping in a mountain WMA; no significant water body adjacent.,WV,state,none,"39.2498,-78.7506",https://wvdnr.gov/lands-waters/wildlife-management-areas/,-7.4143799999999995,slightly cooler,2290
Short Mountain WMA dispersed camping,Dispersed camping in a mountain WMA; no significant water body adjacent.,WV,state,none,"39.2055,-78.6669",https://wvdnr.gov/lands-waters/wildlife-management-areas/,-7.322940000000002,slightly cooler,2286
Gifford Pinchot State Park Campground,"waterfront with view: 319, 320; waterfront w/partial view: 316, 317, 318, 321; water view: 279, 280, 281, 294, 295, 296; private: 164",PA,state,lake,"40.0612,-76.8981",https://pennsylvaniastateparks.reserveamerica.com/camping/gifford-pinchot-state-park/r/campgroundDetails.do?contractCode=PA&parkId=880306,-2.463299999999999,similar,492
Tea Creek Campground,USFS campground along Tea Creek in Monongahela National Forest with sites directly on the creek.,WV,federal,creek,"38.3415,-80.2306",,-8.447040000000005,slightly cooler,3038
Seneca Shadows Campground,"Seneca Shadows is the newest campground in the Spruce Knob-Seneca Rocks National Recreation Area. Many sites offer outstanding views of the 900 foot Seneca Rocks. This is a modern campground with flush toilets, lantern posts, picnic tables and campfire rings. The large facility has a selection of walk-to tent sites, standard RV sites and tent-only group sites.",WV,federal,none,"38.8237,-79.3866",,-4.693500000000004,slightly cooler,1742
Day Run Campground,High-elevation campground in Monongahela National Forest; sites are not confirmed to be directly adjacent to water.,WV,federal,none,"38.2871,-80.2156",,-8.735220000000004,slightly cooler,3146
Bishop Knob Campground,High elevation campground on a mountaintop in Monongahela National Forest; not directly adjacent to a water body.,WV,federal,none,"38.3385,-80.4890",,-8.816040000000005,slightly cooler,3143
Blue Bend Campground,USFS campground with sites directly along Anthony Creek at the Blue Bend swimming area.,WV,federal,creek,"37.9204,-80.2709",,-3.711060000000001,similar,1922
Lake Buffalo Recreation Area,"A primitive camping area next to a 22-acre lake.  Limited dispersed sites are available, primarily for tents or small RVs.  The area is open from March to November.  Campsites do not appear to be lakefront",VA,federal,none,"38.5324,-79.7028",,-8.931060000000004,slightly cooler,3077
Little River Dispersed Camping,"15 numbered sites along the Little River, suitable for tents and small to medium RVs. The setting is peaceful with access to the West Fork Rail Trail and fishing opportunities. The narrow gravel road may be tricky for larger rigs.  Very remote with no cell service, ideal for those seeking solitude. Sites fill up on weekends.",VA,federal,creek,"38.6502,-79.7462",,-9.692999999999996,cooler,3231
C.F. Phelps WMA Public Parking (Kelly's Ford Bridge),Parking/camping alongside Rappahannock River at Kelly's Ford Bridge on VA 620.,VA,state,river,"38.4769,-77.7814",,1.2659399999999994,similar,246
C.F. Phelps WMA Public Parking (Rogers Ford Area),Seasonal-only parking/camping alongside Rappahannock River at southern end of WMA accessible from entrance on 632.,VA,state,river,"38.4175,-77.7364",,1.4547600000000056,similar,223
Worthington State Forest Campsite,"Several RV sites adjacent to the river, some may have partial river views",PA,state,river,"41.0123,-75.0858",,-3.7072800000000057,similar,360
Ricketts Glen State Park,"Numerous waterfront sites, some of which may have a partial lake view",PA,state,lake,"41.3360,-76.2607",,-11.134439999999998,cooler,2280
Tobyhanna State Park,"Some sites from 91-131 may have partial lake view, of which CampsitePhotos.com recommends 101, 111, 113, 115, 117, and 119",PA,state,lake,"41.2191,-75.4054",,-9.906119999999996,cooler,1994
Promised Land State Park,Pickerel Point Campground has RV spots with partial lake views and reasonably easy lake access,PA,state,lake,"41.3132,-75.2089",https://pennsylvaniastateparks.reserveamerica.com/camping/promised-land-state-park/r/campgroundDetails.do?contractCode=PA&parkId=880414,-9.303300000000004,cooler,1778
Green Ridge State Forest Headquarters,"numerous dispersed campsites
Must register at Green Ridge State Forest Headquarters
301-478-3124
Dispersed campsites scattered throughout the state forest on ridges and hollows, not specifically on a water body.",WV,state,none,"39.6651,-78.4431",,-3.4351200000000044,similar,964
Gary's Family Campground,,WV,private,none,"39.5679,-78.3611",,-3.564360000000003,similar,1049
Moon Lake State Recreation Area,"There is a lake nearby, but the dispersed campsites are not lakefront.",PA,state,none,"41.2520,-76.0560",https://pennsylvaniastateparks.reserveamerica.com/camping/pinchot-state-forest/r/campgroundDetails.do?contractCode=PA&parkId=880252#sr_a,-7.1339400000000035,slightly cooler,1200
001 Carvolth,Dispersed campsite in Pinchot State Forest on forested terrain; no water body adjacent.,PA,state,none,"41.2520,-75.6337",https://pennsylvaniastateparks.reserveamerica.com/campsiteDetails.do?contractCode=PA&siteId=23634&parkId=880252,-9.988740000000005,cooler,2001
003 Sassafras Hill,"003 Sassafras Hill
Dispersed campsite on Sassafras Hill in Pinchot State Forest; no water body adjacent.",PA,state,none,"41.2293,-75.6069",https://pennsylvaniastateparks.reserveamerica.com/camping/pinchot-state-forest,-10.357380000000004,cooler,2116
Manny Gordon Pavilion,dispersed sites nearby,PA,state,none,"41.2068,-75.6109",https://pennsylvaniastateparks.reserveamerica.com/camping/pinchot-state-forest,-9.146880000000001,cooler,1788
State Forest Campsite #E011,Dispersed campsite in a Pennsylvania state forest; no direct water frontage.,PA,state,none,"41.3047,-75.1010",,-8.340299999999994,slightly cooler,1512
Delaware State Forest campsite #E014,Dispersed backcountry campsite on the Pocono Plateau; not adjacent to any significant water body.,PA,state,none,"41.2590,-74.9929",,-7.57944,slightly cooler,1322
highline campsite E-9,Dispersed backcountry campsite on an upland ridgeline in Delaware State Forest; not directly on a creek or lake.,PA,state,none,"41.2525,-75.1113",,-7.977239999999996,slightly cooler,1437
E8 - Bridge Camp,"Name suggests proximity to a creek crossing, but the site is not confirmed to be directly on the water.",PA,state,none,"41.2328,-75.1083",,-7.356779999999996,slightly cooler,1273
State Forest Campsite #S006,Dispersed campsite in Delaware State Forest in forested uplands; no direct water frontage.,PA,state,none,"41.1599,-75.0821",,-6.99156,slightly cooler,1207
State Forest Campsite #S001,Dispersed campsite in Delaware State Forest in a wooded upland area.,PA,state,none,"41.1462,-75.1973",,-6.7212000000000005,slightly cooler,1138
"S005 Brodhead Creek, Snow Hill","Delaware State Forest dispersed sites
Named for and located directly on Brodhead Creek at the lowest elevation of the Delaware State Forest dispersed sites.",PA,state,creek,"41.1238,-75.2166",,-5.733180000000005,slightly cooler,872
Weiser State Forest,"Dispersed sites nearby.
Dispersed camping sites in the forest are generally in wooded upland areas, not directly on water.",PA,state,none,"40.5986,-76.0245",https://pennsylvaniastateparks.reserveamerica.com,-3.6763199999999956,similar,561
Sampson State Park,Large NY state park on the eastern shore of Seneca Lake with sites along the lakeshore.,NY,state,lake,"42.7231,-76.9015",,-7.477020000000004,slightly cooler,554
Tompkins Campground,USACE campground on Cowanesque Lake with lakefront sites.,NY,state,lake,"41.9807,-77.1898",,-8.246699999999997,slightly cooler,1145
Ives Run Campground,USACE campground on Hammond/Tioga Lake with sites directly on the lake.,PA,federal,lake,"41.8871,-77.1791",,-8.218619999999994,slightly cooler,1184
Jordan Lake State Recreation Area,Many lakefront campsites.,NC,state,lake,"35.7326,-79.0172",,6.229080000000004,slightly warmer,239
Clearwater Lake campground,"Several sites appear to be lakefront, but view may be blocked by trees.  After-hours gate code from confirmation email required after 6pm
(352) 669-0078",FL,federal,lake,"28.9785,-81.5523",https://www.recreation.gov/camping/campgrounds/234033,19.029960000000003,hot,59
Hopkins Prairie Campground,Hopkins Prairie is a seasonal prairie/marsh in Ocala National Forest; sites are in the surrounding forest and not on a permanent water body.,FL,federal,none,"29.2753,-81.6928",,18.47232,much warmer,65
Wekiwa Springs State Park Campground,"campground is closed for a waterline project and will remain closed throughout 2025
Campground is set back in the forest, not directly on the springs or Wekiwa River.",FL,state,none,"28.7089,-81.4745",,19.28124,hot,124
Blue Spring State Park Campground,Campground is set back in the woods on an elevated area above the spring run and St. Johns River; sites are not directly on the water.,FL,state,none,"28.9480,-81.3353",,19.06146,hot,65
Mike Roess Gold Head Branch State Park,Campground sites are in a wooded area; the park's lakes are in ravines/sinkholes and sites are not directly on them.,FL,state,none,"29.8369,-81.9501",,17.02854,much warmer,187
Paynes Prairie Camping,"Campground is set in upland hammock forest on the edge of the prairie basin, not directly on a water body.",FL,state,none,"29.5260,-82.2946",,17.92746,much warmer,91
Rainbow Springs State Park Campground,Campground is in a separate wooded area set back from the Withlacoochee River; sites are not directly on the water.,FL,state,none,"29.0879,-82.4221",,18.90324,much warmer,39
Rodman Campground,USFS campground on Rodman Reservoir in Ocala National Forest with sites positioned directly along the reservoir shoreline.,FL,federal,lake,"29.5211,-81.7953",,18.029880000000002,much warmer,65
Shangrila Campgrounds,Private campground in an inland area near Ocala National Forest; not on a significant body of water.,FL,private,none,"29.0383,-82.2395",,18.817020000000003,much warmer,88
Ross Prairie Campground,"Ocala National Forest campground in a dry prairie/upland area, not on any water body.",FL,federal,none,"29.0391,-82.2963",,18.89748,much warmer,65
Lake Griffin State Park,"There is a lake in the park, but the campground is not lakefront.",FL,state,none,"28.8564,-81.9026",,19.027440000000002,hot,121
Oscar Scherer State Park,"South Creek runs through the park but the campsites are in a wooded upland area, not directly on the creek.",FL,state,none,"27.1721,-82.4649",,22.37508,hot,32
Colt Creek State Park,Colt Creek runs through the park but the campground area is set back from the creek in an upland area.,FL,state,none,"28.2893,-82.0417",,20.04822,hot,121
Lake Louisa State Park,"Some campsites are very close to the lake, but view may be blocked by trees.",FL,state,lake,"28.4470,-81.7411",,19.70586,hot,137
Alafia River State Park,The river runs through the park but the campground is on a former phosphate mining site set back from the river.,FL,state,none,"27.7782,-82.1391",,21.015000000000004,hot,108
Lake Kissimmee State Park,"There is a lake in the park, but the campground is not lakefront.",FL,state,none,"27.9472,-81.3515",,20.816100000000002,hot,78
Highlands Hammock State Park Campground,Campground is set in a hammock forest; the park has a cypress swamp but the campground is in an upland area.,FL,state,none,"27.4747,-81.5303",,21.479400000000002,hot,131
Kissimmee Prairie Preserve Family Campground,"Campground is in an open dry prairie setting, not on any water body.",FL,state,none,"27.5822,-81.0435",,21.4848,hot,75
Silver Lake Campground,"Some campsites are very close to the lake, but view may be blocked by trees.",FL,federal,lake,"28.5750,-82.2187",,19.68606,hot,78
Holder Mine Campground,"Small primitive campground in Withlacoochee State Forest in an upland forest setting, not directly on water.",FL,federal,none,"28.8004,-82.3826",,19.25694,hot,85
Tiger Bay State Forest,"Low-lying flatwoods area; while there may be seasonal wetlands nearby, the camping area is not on a defined water body.",FL,state,none,"29.2075,-81.1776",,18.73476,much warmer,26
River Junction Campground Withalacochee State Forest,"(352) 797-4140
Named for and positioned at a river junction; campground has sites along the Withlacoochee River.",FL,state,river,"28.5765,-82.1992",,19.65996,hot,85
"Hog Island Recreation Area, Campground & Kayak Launch","(352) 797-4140
Campground with kayak launch on the Withlacoochee River; sites are directly on the river.",FL,state,river,"28.6194,-82.2412",,19.58274,hot,85
Mutual Mine Campground,"Former mining site campground in Withlacoochee State Forest in an upland area, not directly on water.",FL,state,none,"28.7583,-82.3543",,19.414620000000003,hot,62
Huguenot Campground,(904) 255-4255.  Several sites are waterfront or just on the other side of the drive from the water.  Pretty much all sites have a water view.,FL,local,river,"30.4066,-81.4119",https://fljacksonweb.myvscloud.com,16.65828,much warmer,3
Hanna Park Campground,(904) 255-4255.  Park is on the ocean but campground is not,FL,local,none,"30.3639,-81.4018",https://fljacksonweb.myvscloud.com,16.618139999999997,much warmer,36
Crooked River State Park,"RVLife 9.5/10
912-882-5256
The park is on the Crooked River, but the campground sites are in a wooded area set back from the river.",GA,state,none,"30.8407,-81.5514",https://gastateparks.org/CrookedRiver,15.713100000000003,much warmer,49
Blythe Island Regional Park,"912-279-2812 Mon-Sat 8:30am-5pm
The park borders waterways, but the campground sites are in wooded interior loops, not confirmed to be directly on the river.",GA,local,none,"31.1559,-81.5429",,15.134040000000004,much warmer,52
Huntington Beach State Park Campground,"Recommended in _Where_Should_We_Camp_Next?_
RVLife 9.4/10
Sites on the ocean side are immediately behind the dunes with direct beach access on the Atlantic Ocean.",SC,state,ocean,"33.5064,-79.0636",,11.125440000000001,warmer,-9
Myrtle Beach State Park Campground,"Recommended in _Where_Should_We_Camp_Next?_
843-238-5325
RVLife 8.6/10
Easy walk to the beach, but campground is not waterfront",SC,state,none,"33.6541,-78.9276",https://southcarolinaparks.com/myrtle-beach/camping,10.84788,warmer,-6
Colleton State Park,"RVLife 8.6/10
Small SC state park directly on the Edisto River with campsites along the river, a popular canoe/kayak spot.",SC,state,river,"33.0625,-80.6159",,11.397960000000001,warmer,137
Rivers End Campground & RV Park,"Recommended in _Where_Should_We_Camp_Next?_
RVLife 8.7/10
Interior RV park on Tybee Island; not directly on the beach or river despite the island location.",GA,private,none,"32.0231,-80.8512",,13.678380000000002,warmer,22
Hunting Island Campground,"The campground is within an easy walk of the beach, but not close enough to be considered waterfront.
Recommended in _Where_Should_We_Camp_Next?_ by Stephanie Puglisi
RVLife 9.1/10",SC,state,none,"32.3844,-80.4317",,13.086540000000001,warmer,6
Skidaway Island State Park,"Recommended in _Where_Should_We_Camp_Next?_ by Stephanie Puglisi
RVLife 9.2/10
Campground is set in a maritime forest interior; the marsh and Skidaway Narrows are accessed via trails.",GA,state,none,"31.9548,-81.0526",https://thedyrt.com/press/2025-best-places-to-camp-in-the-southeast-region/,13.684320000000003,warmer,55
Fort McAllister Campground,"RFLife 9.2/10
912-727-2339 or 912-727-4058
GA state park campground with sites along the Ogeechee River with river views and direct access.",GA,state,river,"31.8843,-81.1807",,13.764420000000001,warmer,68
Cat Head Creek RV Park,"RVLife 9.4/10
Private RV park on Cat Head Creek, a tidal creek on the Georgia coast.",GA,private,creek,"31.4246,-81.4887",,14.755679999999996,much warmer,22
McIntosh Lake RV Park,"No check-in after 6pm.  RVLife 8.8/10.  Although no sites are directly on the lake, several are right across the driveway from the lake.",GA,private,lakeview,"31.5378,-81.4573",,14.528519999999999,much warmer,29
South Newport Campground,"RVLife 7.3/10
Private campground near the Georgia coast; no confirmed waterfront camping.",GA,private,none,"31.6137,-81.4017",,14.345099999999997,much warmer,42
Pound River Campground,Campground along the Pound River in southwestern Virginia with sites on the river.,VA,private,river,"37.1965,-82.4402",,-0.7466400000000001,similar,1456
Mohican State Park Campground,"Sites are out in the open, but the park is worth seeing.
Recommended in _Where_Should_We_Camp_Next?_ by Stephanie Puglisi
Campground is on a hilltop/plateau area; the Clear Fork of the Mohican River runs through the park's gorge below.",OH,state,none,"40.6096,-82.2576",,-5.006520000000001,slightly cooler,928
Old Man's Cave Campground,"Recommended in _Where_Should_We_Camp_Next?_ by Stephanie Puglisi
Hocking Hills State Park campground on a hilltop above the gorge; not directly on a water body.",OH,state,none,"39.4375,-82.5381",,-2.9084399999999997,similar,931
Ludington State Park and Campgrounds,"Recommended in _Where_Should_We_Camp_Next?_ by Stephanie Puglisi
Beechwood campground has sites directly on the shore of Hamlin Lake; Pines campground is near Lake Michigan.",MI,state,lake,"44.0515,-86.4945",,-10.148939999999996,cooler,633
Lower Falls Portage Campground,"Recommended in _Where_Should_We_Camp_Next?_ by Stephanie Puglisi
Small campground at Tahquamenon Falls State Park with sites directly along the Tahquamenon River near the portage route.",MI,federal,river,"46.6032,-85.1979",,-14.7537,much cooler,636
Platte River Campground,"Recommended in _Where_Should_We_Camp_Next?_ by Stephanie Puglisi
NPS campground in Sleeping Bear Dunes National Lakeshore with sites directly along the Platte River.",MI,federal,river,"44.7156,-86.1160",,-11.250720000000003,cooler,606
Reelfoot State Park Campground,"Recommended in _Where_Should_We_Camp_Next?_ by Stephanie Puglisi
Campground on Reelfoot Lake with waterfront sites offering direct lake access.",TN,state,lake,"36.3634,-89.4330",,4.906440000000003,slightly warmer,292
Smokemont Campground,"Recommended in _Where_Should_We_Camp_Next?_ by Stephanie Puglisi
Great Smoky Mountains NPS campground with sites in loops directly along the Oconaluftee River and Bradley Fork.",NC,federal,river,"35.5592,-83.3118",,-0.8297999999999942,similar,2306
Mammoth Cave Campground,"Recommended in _Where_Should_We_Camp_Next?_ by Stephanie Puglisi
Campground is on a ridgetop above the Green River; the river runs through the park below but the campground is in an upland forested area.",KY,federal,none,"37.1820,-86.0968",,1.6662599999999963,similar,787
Wax Campground,"Recommended in _Where_Should_We_Camp_Next?_ by Stephanie Puglisi
USACE campground on Nolin River Lake with lakefront campsites.",KY,federal,lake,"37.3452,-86.1272",,2.2383000000000033,similar,544
Cloudland Canyon State Park,"Recommended in _Where_Should_We_Camp_Next?_ by Stephanie Puglisi
Campground is on the canyon rim, not directly on any water body.",GA,state,none,"34.8395,-85.4840",,2.3727599999999986,similar,1771
Stone Mountain State Park,"Recommended in _Where_Should_We_Camp_Next?_ by Stephanie Puglisi
Campground sites in the lower loops are positioned directly along the East Prong Roaring River.",NC,state,creek,"36.3829,-81.0225",,-0.8031599999999987,similar,1883
Topsail Hill Preserve State Park,"Recommended in _Where_Should_We_Camp_Next?_ by Stephanie Puglisi
RV/tent campsite area is inland in a wooded area; the beach and Campbell Lake require a tram ride or walk.",FL,state,none,"30.3711,-86.2748",https://thedyrt.com/press/2025-best-places-to-camp-in-the-southeast-region/,16.628580000000003,much warmer,29
Gunter Hill Campground,"Recommended in _Where_Should_We_Camp_Next?_ by Stephanie Puglisi
USACE campground on the Alabama River/Woodruff Lake with waterfront sites on the reservoir.",AL,federal,lake,"32.3586,-86.4548",,12.489479999999995,warmer,187
DeSoto State Park,"Recommended in _Where_Should_We_Camp_Next?_ by Stephanie Puglisi
The Little River runs through the park, but the main campground is on the plateau, not directly on the river.",AL,state,none,"34.4971,-85.6273",,3.562379999999995,similar,1610
Cheaha State Park,"Recommended in _Where_Should_We_Camp_Next?_ by Stephanie Puglisi
Mountaintop campground at the highest point in Alabama; no significant water frontage.",AL,state,none,"33.4786,-85.8094",,3.5119800000000008,similar,2139
Monte Sano State Park Campground,"Recommended in _Where_Should_We_Camp_Next?_ by Stephanie Puglisi
Campground is on a mountain plateau without waterfront access.",AL,state,none,"34.7455,-86.5121",,3.0801600000000007,similar,1620
Gulf State Park Campground,"Recommended in _Where_Should_We_Camp_Next?_ by Stephanie Puglisi
Campground loops are arranged around Middle Lake with some sites directly on the lakeshore.",AL,state,lake,"30.2600,-87.6486",,16.86366,much warmer,19
Leonard Harrison campground,"Recommended in _Where_Should_We_Camp_Next?_ by Stephanie Puglisi
Campground is on the rim of Pine Creek Gorge, far above Pine Creek; not waterfront.",PA,state,none,"41.6975,-77.4497",,-10.322639999999996,cooler,1870
Woodford State Park,"Recommended in _Where_Should_We_Camp_Next?_ by Stephanie Puglisi
Campground wraps around Adams Reservoir with multiple sites directly on the shoreline.",VT,state,lake,"42.8912,-73.0385",,-14.144399999999996,much cooler,2339
George Washington State Campground and Management Area,"Recommended in _Where_Should_We_Camp_Next?_ by Stephanie Puglisi
Campground has sites directly on Bowdish Reservoir.",RI,state,pond,"41.9220,-71.7550",,-6.257339999999995,slightly cooler,616
Burlingame State Campgrounds,"Recommended in _Where_Should_We_Camp_Next?_ by Stephanie Puglisi
Sites directly along the shore of Watchaug Pond.",RI,state,pond,"41.3618,-71.7013",,-3.435480000000004,similar,108
Ellacoya State Park,"Recommended in _Where_Should_We_Camp_Next?_ by Stephanie Puglisi
Small state park directly on the shore of Lake Winnipesaukee with RV sites adjacent to the beach/lake.",NH,state,lake,"43.5737,-71.3544",,-8.867700000000005,slightly cooler,515
Beartown State Forest,"Limited number of RV spots.  $40 non-resident.  Recommended in _Where_Should_We_Camp_Next?_ by Stephanie Puglisi
Campground sites along the shore of Benedict Pond.",MA,state,pond,"42.2334,-73.2746",,-10.947960000000005,cooler,1775
Schoodic Woods Campground,Recommended in _Where_Should_We_Camp_Next?_ by Stephanie Puglisi,ME,federal,none,"44.3814,-68.0644","https://www.nps.gov/acad/planyourvisit/schoodic-woods-campground.htm
https://www.recreation.gov/camping/campgrounds/251833
https://thedyrt.com/camping/maine/schoodic-woods-campground",-9.16326,cooler,190
Camden Hills State Park,"Recommended in _Where_Should_We_Camp_Next?_ by Stephanie Puglisi
Park is on the bay but campsites do not appear to be waterfront",ME,state,none,"44.2311,-69.0483",,-8.998019999999997,slightly cooler,219
Black Rock State Park,"Recommended in _Where_Should_We_Camp_Next?_ by Stephanie Puglisi
Campground sites are in a wooded area set back from Black Rock Pond; the pond has a swimming area but campsites are not directly on it.",CT,state,none,"41.6469,-73.0967",,-5.036760000000005,slightly cooler,413
Hammonasset Beach State Park,"Recommended in _Where_Should_We_Camp_Next?_ by Stephanie Puglisi
Connecticut's largest shoreline park; campground is directly behind the dune/beach area on Long Island Sound.",CT,state,ocean,"41.2667,-72.5584",,-2.9016,similar,6
Watkins Glen State Park Six Nations Camping Area,"Recommended in _Where_Should_We_Camp_Next?_ by Stephanie Puglisi
Campground is on a hilltop above the gorge; Seneca Lake is nearby but the campground is not waterfront.",NY,state,none,"42.3705,-76.8824",,-8.375039999999998,slightly cooler,984
