phone,name,state,website,note,waterfront,location,ownership,delta_temp,climate,elevation_feet
,Seven Mile Campground,WV,https://wvstateparks.com/parks/seneca-state-forest/lodging/,Small attractive campground fairly high up in the Seneca State Forest.  Book online via website.  --AWH,none,"38.3068,-79.9223",federal,-7.2262800000000045,slightly cooler,2713
,Cranberry River sites 6-19,WV,,Dispersed waterfront sites along the Cranberry River. --AWH,river,"38.2955,-80.5161",federal,-5.544539999999994,slightly cooler,2247
,Big Rock Campground,WV,,USFS campground across the road from the Cranberry River.  Sites are not waterfront. --AWH,river,"38.2959,-80.5240",federal,-5.615460000000006,slightly cooler,2267
,Cranberry Campground,WV,,USFS campground across the road from the Cranberry River.  Sites are not waterfront. --AWH,none,"38.3255,-80.4415",federal,-6.815339999999996,slightly cooler,2588
,Island Campground,WV,,High elevation USFS campground with mostly tent sites.  Site 13 is the only creekside site that will fit an RV. --AWH,creek,"38.5793,-79.7052",federal,-8.933580000000006,slightly cooler,3054
,Grandview Sandbar Campground,WV,,"NPS campground with waterfront sites on a sandbar in the New River; no fee, first-come-first-served. --AWH",river,"37.8552,-81.0531",federal,-1.440900000000006,similar,1318
,Groundhog Trail Parking Lot,VA,,This is a small gravel trailhead parking lot off of VA-219/24 (Spruce Run).  There is a sign that says 'Sugar Camp Parking'.  The nearby Groundhog Trail leads up to the Appalacian Trail which runs along the ridgetop. --AWH,none,"37.4241,-80.6763",federal,-3.6718200000000047,similar,2162
,Meadow Creek dispersed camp sites,WV,,Multiple dispersed campsites along Meadow Creek near Lake Sherwood Recreation Area. --AWH,none,"37.9595,-80.0703",federal,-5.887439999999998,slightly cooler,2513
,Beckys Creek Wildlife Management Area,WV,,Dispersed camping sites along Becky Creek.  Camp in designated sites only. --AWH,creek,"38.5907,-79.9608",federal,-8.532899999999996,slightly cooler,2936
,Shaver's Fork Dispersed Campsites,WV,,High-elevation dispersed wooded riverfront campsites spread out along the Shavers Fork of the Cheat River. --AWH,river,"38.6081,-79.8811",federal,-11.02122,cooler,3625
,Stonecoal dispersed camping,WV,https://thedyrt.com/camping/west-virginia/stonecoal-dispersed-camping-area,Many high-elevation dispersed wooded riverfront campsites spread out along the Shavers Fork of the Cheat River. --AWH,river,"38.6353,-79.8718",federal,-10.976580000000002,cooler,3599
,Lower Glady Dispersed Campground,WV,https://thedyrt.com/camping/west-virginia/lower-glady-dispersed-campground,Many dispersed wooded riverfront campsites spread out along the Cheat River. --AWH,river,"38.9637,-79.6070",federal,-7.086600000000004,slightly cooler,2342
,Gladwin Dispersed Camping Area,WV,https://thedyrt.com/camping/west-virginia/gladwin-dispersed-camping,"Several dispersed wooded riverfront campsites along the Glady Fork of the Cheat River, including one site on the other side of a low water bridge.  Avoid the nearby field which is private property. --AWH",river,"39.0077,-79.5493",federal,-5.913899999999999,slightly cooler,1991
,Camp Run Campground,WV,https://www.fs.usda.gov/r08/gwj/recreation/camp-run-campground,First-come-first-served USFS campground with several sites are right on the creek.  No fee; open year round.  --AWH,creek,"38.7475,-79.1089",federal,-4.193640000000004,slightly cooler,1640
,Dolly Sods bookdocking sites #2,WV,,Dolly Sods high-elevation plateau; no waterfront. --AWH,none,"39.0660,-79.3016",federal,-12.933540000000004,cooler,3930
,Dolly Sods boondocking sites #1,WV,,Dolly Sods dispersed wilderness area; not on a water body. --AWH,none,"39.0574,-79.2847",federal,-9.31446,cooler,2920
,Squirrel Gap Road Parking,WV,,large paved parking lot just off of US-48 --AWH,none,"39.0676,-78.6378",federal,-4.336919999999997,slightly cooler,1519
,Hawk Recreation Area,VA,, --AWH,none,"39.1165,-78.4989",federal,-4.0973400000000035,slightly cooler,1427
,Long Run Road Campsite #2,VA,,Unverified high-elevation dispersed site; road may require 4WD.  --AWH,none,"38.5813,-79.0523",federal,-9.253079999999997,cooler,3143
,Long Run Road Campsite #1,VA,,Unverified high-elevation dispersed site; road may require 4WD.  --AWH,none,"38.5774,-79.0371",federal,-10.123559999999994,cooler,3389
,Western-Facing Campsite on a spur off of Long Run Road,VA,,Unverified high-elevation dispersed site; road may require 4WD.  --AWH,none,"38.5950,-79.0710",federal,-11.114639999999998,cooler,3658
,Long Run Road Campsite #3,VA,,Unverified high-elevation dispersed site; road may require 4WD.  --AWH,none,"38.5867,-79.0579",federal,-10.2339,cooler,3415
304-668-9011,"Back Ridge Shadows, LLC",WV,https://backridgeshadowsllc.godaddysites.com/,Private campground at high elevation near Spruce Knob; not waterfront. --AWH,none,"38.6734,-79.5699",private,-12.378960000000001,cooler,3973
,High Country Campground,VA,,Private high-elevation mountain campground in the Mt. Rogers area; not waterfront. --AWH,none,"36.6648,-81.6031",private,-6.3415799999999996,slightly cooler,3294
,Grindstone Campground,VA,,Private high-elevation mountain campground; not waterfront. --AWH,none,"36.6883,-81.5393",private,-7.939979999999996,slightly cooler,3730
,Canaan Valley Resort Campground,WV,,High-elevation campground.  --AWH,none,"39.0142,-79.4568",state,-10.453500000000004,cooler,3261
,Gatewood Park Campground,VA,,Municipal park campground on Gatewood Reservoir with some lakefront sites. --AWH,lake,"37.0440,-80.8715",local,-3.104639999999994,similar,2194
,Summit Lake Campground,WV,,"High-elevation campground.  There is a lake nearby, but the campsites are not lakefront --AWH",none,"38.2484,-80.4448",federal,-9.905759999999994,cooler,3494
,Grayson Highlands State Park,VA,,High-altitude campground known for meadows and wild ponies; no waterfront. --AWH,none,"36.6286,-81.4966",state,-11.167019999999999,cooler,4665
,Bark Camp Recreation Area,VA,,USFS campground set back in the woods near Bark Camp Lake.  Campsites are not lakefront. --AWH,none,"36.8694,-82.5263",federal,-5.212259999999998,slightly cooler,2874
,Flag Rock Recreational Area,VA,https://www.nortonva.gov/467/Campground,High-elevation campground operated by City of Norton; $20/night first-come-first-served; fresh water and dump station; closed winters. --AWH,none,"36.9122,-82.6330",local,-6.985799999999998,slightly cooler,3349
,High Knob Recreation Area,VA,,USFS high-elevation campground near High Knob Lookout Tower.  Campsites are not waterfront. --AWH,none,"36.8876,-82.6140",federal,-8.029619999999998,slightly cooler,3655
,Fort Frederick State Park,WV,,Multiple waterfront sites on a bluff overlooking the Potomac River.  View may be blocked by vegetation. --AWH,river,"39.6066,-78.0100",state,-1.4227200000000002,similar,429
,French Creek State Park Campground,PA,https://pennsylvaniastateparks.reserveamerica.com/camping/french-creek-state-park/r/campgroundDetails.do?contractCode=PA&parkId=880406,"There is a lake in the park, but the campground is not lakefront. --AWH",none,"40.2159,-75.7838",state,-4.2978599999999965,slightly cooler,928
,Crooked Creek Campground,PA,,USACE campground close to the lake but not lakefront. --AWH,none,"40.7092,-79.5158",federal,-5.431500000000005,slightly cooler,997
,Christopher Run Campground,VA,,"Note that the campground's lakefront sites are on the beach, and the beach is open to anyone who is staying at the campground. --AWH",lake,"38.0973,-77.8923",private,1.8673200000000054,similar,269
,Machicomoco State Park Campground,VA,,Park is located along the York river.  Campground is not waterfront. --AWH,none,"37.3092,-76.5496",state,4.093200000000006,slightly warmer,42
,Newport News Park,VA,https://nnparksandrec.org/newportnewspark/,Park is located on the city reservoir.  Some campsites appear to be waterfront. --AWH,lake,"37.1905,-76.5481",local,4.22496,slightly warmer,65
,Chippokes State Park,VA,,"The park borders the James River, but the campground is inland in a wooded area well away from the river. --AWH",none,"37.1403,-76.7484",state,4.1983199999999945,slightly warmer,98
,Williamsburg Christian Retreat Center,VA,,Inland retreat center; not on a significant water body. --AWH,none,"37.4248,-76.8522",private,3.627720000000004,similar,114
,Buffalo Park and Campground,VA,,several sites are right on the beach --AWH,lake,"36.6619,-78.6292",federal,4.1819399999999955,slightly warmer,344
,Longwood Park,VA,https://www.recreation.gov/camping/campgrounds/233545,Multiple waterfront campsites directly on the lakeshore --AWH,lake,"36.5768,-78.5488",federal,4.417020000000003,slightly warmer,321
,Rudds Creek Campground,VA,,COE-style campground with many sites right on the lake --AWH,lake,"36.6575,-78.4423",federal,4.283460000000002,slightly warmer,318
,Goose Point Park,VA,,USACE campground on a peninsula jutting into Philpott Lake with multiple campsites directly on the lakeshore. --AWH,lake,"36.8045,-80.0587",federal,1.047060000000005,similar,1151
,Salthouse Branch Park,VA,,USACE campground on Philpott Lake with campsites near the lakeshore. --AWH,lakeview,"36.8135,-80.0387",federal,1.4520600000000043,similar,1033
,Horseshoe Point Park,VA,,USACE campground on a horseshoe-shaped point in Philpott Lake with sites directly on the lakeshore. --AWH,lake,"36.8341,-80.0723",federal,1.5553800000000013,similar,994
,Gerald Freeman Campground,WV,https://www.recreation.gov/camping/campgrounds/233678,Multiple waterfront campsites along the Holly River --AWH,lake,"38.6705,-80.5472",federal,-1.6916399999999945,similar,977
,Battle Run Campground,WV,,Campground on a peninsula in Summersville lake.  Many sites are right on the water. --AWH,lake,"38.2216,-80.9096",federal,-3.364020000000004,similar,1673
,Bolar Mountain Recreation Area,VA,,USFS campground on the shore of Lake Moomaw with sites directly on the lake shoreline.  Route 603 NW of the campground is a narrow one-lane gravel road with steep drop-offs not suitable for RVs.  Campground should be accessed from route 600 instead. --AWH,lake,"37.9848,-79.9696",federal,-2.8090799999999994,similar,1637
,Assateague State Park,MD,,Campground is oceanfront but view and access are blocked by dunes --AWH,coastal dunes,"38.2374,-75.1374",state,2.5745399999999985,similar,0
,North Bend Park & Campground,VA,,COE-style campground with many lakefront sites --AWH,lake,"36.5861,-78.3081",federal,4.435379999999998,slightly warmer,311
,Lover's Leap Campground,VA,,Two camp loops on a hill in a wooded area --AWH,none,"36.7022,-82.7380",federal,-1.2023999999999955,similar,1834
,San Carlos RV Park & Islands,FL,https://www.sancarlosrv.com/,Waterfront RV park in the Fort Myers Beach area with sites directly on San Carlos Bay. --AWH,bay,"26.4683,-81.9495",private,23.688720000000004,hot,19
,Gulf Air,FL,,Campground is not on the water --AWH,none,"26.4901,-81.9408",private,23.67288,hot,13
,Koreshan State Park,FL,https://reserve.floridastateparks.org/Web/,Campground is in a wooded area --AWH,none,"26.4340,-81.8157",state,23.691959999999998,hot,36
,Periwinkle Park Campground,FL,,Interior campground on Sanibel Island; not directly on the beach or bay. --AWH,coastal woods,"26.4440,-82.0427",private,23.74416,hot,16
,Ohiopyle State Park Kentuck Campground,PA,,Kentuck Campground is on a ridge/plateau away from the Youghiogheny River. --AWH,none,"39.8888,-79.4945",state,-6.318180000000006,slightly cooler,1660
,Laurel Hill State Park Campground,PA,,The park has Laurel Hill Lake but the campground is set back in the woods; the lake and beach area are a walk from the campground loops. --AWH,none,"39.9922,-79.2421",state,-7.615799999999994,slightly cooler,1971
,Vermilion Travel Plaza,OH,,"Travel plaza-style campground in Vermilion, OH; not a waterfront campground. --AWH",none,"41.3776,-82.2244",private,-5.698620000000002,slightly cooler,734
,Findley State Park,OH,,Findley State Park has Findley Lake but the campground is in a standard wooded loop design set back from the lakeshore. --AWH,none,"41.1314,-82.2087",state,-5.758559999999999,slightly cooler,876
,Silver Springs Campground,OH,,"Private campground near Stow/Akron, OH; no significant water body indicated. --AWH",none,"41.1939,-81.4057",private,-6.690059999999999,slightly cooler,1105
,Wilderness State Park Campground,MI,,Lakeshore campground loop has sites right on Lake Michigan. --AWH,lake,"45.7444,-84.9022",state,-13.125959999999997,cooler,613
,Pokagon State Park,IN,,The campground on Lake James does not have sites directly on the lake; the campground is set back in the woods. --AWH,none,"41.7044,-85.0288",state,-7.351559999999998,slightly cooler,1033
,Harrison Lake State Park,OH,,"Some campsites in the South Campground are lakefront, but vegetation or berms may block the view. --AWH",lake,"41.6443,-84.3719",state,-6.436080000000002,slightly cooler,807
,Indiana Dunes State Park Campground Showers and Bathrooms,IN,,"While the park is on Lake Michigan, the campground is set back in the dunes/woods behind the beach. --AWH",coastal woods,"41.6576,-87.0554",state,-5.8282200000000035,slightly cooler,629
,Straits State Park,MI,,A small number of non-electric tent/RV sites are directly on the lake. --AWH,lake,"45.8551,-84.7195",state,-13.52412,cooler,669
,West Branch State Park Campground,OH,,The park has a reservoir but the campground is in a standard wooded loop layout not directly on the shoreline. --AWH,none,"41.1428,-81.1129",state,-6.399180000000002,slightly cooler,1049
,Covert Township Park,MI,,Small campground set back in a wooded area a short walk from the lake. --AWH,coastal woods,"42.2993,-86.3259",local,-7.065180000000004,slightly cooler,652
,Van Buren State Park,MI,,Campground is set back in a wooded area a short walk from the lake. --AWH,coastal woods,"42.3346,-86.3006",state,-7.140420000000003,slightly cooler,656
,Illinois Beach State Park Campground,IL,,Campsites are lakefront but are set behind dunes and some vegetation. --AWH,coastal dunes,"42.4366,-87.8071",state,-7.113419999999997,slightly cooler,597
,Warren Dunes State Park Campground,MI,,"While the park is on Lake Michigan, the campground is set back from the beach in a wooded area behind the substantial dunes. --AWH",coastal woods,"41.9100,-86.5871",state,-6.282539999999994,slightly cooler,629
919-965-5923,North Pointe RV Resort,NC,https://www.campspot.com/book/northpointervresort,Adjacent to I-95 and a small pond.  --AWH,pond,"35.5319,-78.2632",private,6.824339999999999,slightly warmer,173
,Kohler-Andrae State Park,WI,,Campground is close to the lakeshore but is set back in a wooded area. --AWH,coastal woods,"43.6651,-87.7192",state,-9.336420000000004,cooler,600
,Point Beach Campground,WI,,Campground is close to the lakeshore but is set back in a wooded area. --AWH,coastal woods,"44.1827,-87.5273",state,-10.314899999999994,cooler,613
,Hoeft State Park,MI,,Park on Lake Huron with sandy beach.  Campground is in a wooded area adjacent to the beach.  --AWH,coastal woods,"45.4637,-83.8836",state,-12.737700000000006,cooler,646
,Maumee Bay State Park,OH,,Campground on Maumee Bay of Lake Erie.  Campsites are not waterfront. --AWH,coastal woods,"41.6789,-83.3740",state,-5.667659999999997,slightly cooler,574
,Twelvemile Beach Campground,MI,,Pictured Rocks campground perched on a bluff directly above the Lake Superior beach.  Some sites are lakefront but are set back slightly into the woods. --AWH,lake,"46.6398,-86.2157",federal,-14.702580000000001,much cooler,603
,Munising Tourist Park Campground,MI,,Municipal campground right on the shore of Lake Superior in Munising Bay with several waterfront sites. --AWH,lake,"46.4410,-86.6774",local,-14.297940000000004,much cooler,590
,Hurricane River Campground,MI,,Pictured Rocks campground at the mouth of Hurricane River.  All campsites are set back in the woods. --AWH,coastal woods,"46.6656,-86.1667",federal,-14.737319999999997,much cooler,600
,Woodland Park Campground,MI,,Municipal campground in Grand Marais.  All sites are separated from the lake by a driveway. --AWH,lakeview,"46.6733,-85.9911",local,-14.891579999999996,much cooler,639
,Harrisville State Park,MI,,Campground with some sites right on the sandy Lake Huron beach. --AWH,lake,"44.6475,-83.2976",state,-11.256840000000002,cooler,643
,Muskallonge Lake State Park,MI,https://midnrreservations.com/,Many waterfront sites on Muskallonge Lake.  Lake Superior is a short walk away.  --AWH,lake,"46.6766,-85.6281",state,-14.874120000000001,much cooler,633
,Tawas Point Campground,MI,,Campground on a sandy point extending into Lake Huron.  At least a few sites are directly on the lake. --AWH,lake,"44.2577,-83.4448",state,-10.3563,cooler,587
,Bill and Nancy Snyder's property,PA,,Private property in western PA; no indication of waterfront. --AWH,none,"41.2152,-80.3134",private,-7.009200000000005,slightly cooler,1184
,Dunewood Campground,IN,,Indiana Dunes National Park campground set back from Lake Michigan in a wooded area. --AWH,coastal woods,"41.6709,-86.9829",federal,-5.934060000000006,slightly cooler,652
,Gamble Rogers,FL,https://reserve.floridastateparks.org/Web/,"About half the sites in the beachside loop are oceanfront, but dunes and vegetation may block the view. --AWH",coastal dunes,"29.4380,-81.1100",state,18.343260000000004,much warmer,19
,Cypress Glen Campground,FL,https://reserve.floridastateparks.org/Web/,"Withlacoochee State Forest campground in a forested setting, not directly on a lake or river. --AWH",none,"28.5704,-82.2115",state,19.63584,hot,95
,Hillsborough River State Park,FL,https://reserve.floridastateparks.org/Web/,The river runs through the park but the campground is a standard loop set back in the woods; sites are not directly on the riverbank. --AWH,none,"28.1427,-82.2272",state,20.452499999999997,hot,82
843-537-9656,Cheraw State Park,SC,"https://reserve.southcarolinaparks.com/cheraw
https://www.campsitephotos.com/campground/sc/cheraw-state-park/",Several sites are right on the lake.  To book a single night call the park directly within one week of arrival. --AWH,lake,"34.6410,-79.9006",state,8.568360000000004,slightly warmer,134
,Jekyll Island Campground,GA,,Campground in the interior of Jekyll Island surrounded by live oaks; not directly on the beach or marsh. --AWH,coastal woods,"31.1075,-81.4128",local,15.209459999999996,much warmer,55
,Pocahontas State Park,VA,,The park has lakes but the campground is set back in the woods; not lakefront. --AWH,none,"37.3724,-77.5715",state,3.101940000000002,similar,288
,Lake Aire RV Park & Campground,SC,https://www.lakeairerv.com/,110 Sites of which about 12-15 appear to be directly on a small pond for about $65/night --AWH,pond,"32.7774,-80.1467",private,12.26214,warmer,39
,Seven Points Campground,PA,,Raystown Lake COE campground w/many waterfront sites --AWH,lake,"40.3842,-78.0760",federal,-4.904999999999999,slightly cooler,1013
,Geneva State Park Campground,OH,,There are a few rather expensive full-hookup sites that are lakefront.  The rest are set back from the lake in a wooded area. --AWH,lake,"41.8511,-80.9873",state,-6.047820000000004,slightly cooler,593
,East Harbor State Park,OH,,The campground is inland from Lake Erie in a wooded area; the beach is separate from the camping area. --AWH,coastal woods,"41.5446,-82.8203",state,-5.4493200000000055,slightly cooler,580
,Kelleys Island State Park,OH,,"Campground has waterfront tent sites, but RV sites are set back a ways from the water. --AWH",lakeview,"41.6144,-82.7062",state,-5.598360000000007,slightly cooler,587
,South Bass Island State Park,OH,,"Campground has waterfront tent sites, but RV sites are set back a ways from the water. --AWH",lakeview,"41.6427,-82.8355",state,-5.637599999999996,slightly cooler,584
,Yellow Creek Campground,PA,,Wooded campground across from Yellow Creek State Park.  Some sites along a creek. --AWH,creek,"40.5842,-79.0006",federal,-6.353100000000004,slightly cooler,1318
304-259-5216,Blackwater Falls Campground,WV,https://book.wvstateparks.com/ecomm/listings/supplierdetail/7816932/en-US/?supplierid=11067324,High-elevation mountain campground near the falls but not waterfront. --AWH,none,"39.1165,-79.4895",state,-10.286640000000004,cooler,3162
910-842-6488,Holden Beach Pier Campground,NC,"https://www.ncbrunswick.com/places-to-stay/camping-rv/
https://hbtownhall.com/parks-%26-recreation",Located on the Holden Beach barrier island directly on the Atlantic Ocean. Six RV sites. --AWH,coastal dunes,"33.9111,-78.2972",local,10.361880000000005,warmer,0
,Carolina Beach State Park,NC,,The park is on the Cape Fear River but the campground is set back in the maritime forest; campsites are not directly on the water. --AWH,coastal woods,"34.0459,-77.9139",state,10.072439999999995,warmer,13
,Cherry Hill Recreation Area,SC,,USFS campground in Sumter National Forest with some campsites along a small creek. --AWH,creek,"34.9417,-83.0875",federal,0.433800000000005,similar,2263
,Fore Lake Campground,FL,,"This park is on a lake, but the campground is not lakefront --AWH",none,"29.2737,-81.9204",federal,18.334799999999998,much warmer,104
,Alexander Springs Recreation Area,FL,,Ocala National Forest campground near the beautiful turquoise waters of Alexander Springs.  Campsites are not waterfront. --AWH,none,"29.0803,-81.5776",federal,18.799919999999997,much warmer,72
,Jack Hill State Park,GA,,"The park has a mill pond/lake but the campground is set back in the woods, not directly on the water. --AWH",none,"32.0844,-82.1255",state,12.936239999999996,warmer,200
843-498-6478,Campbell's Lake,SC,https://www.scfc.gov/state-lands/sand-hills-state-forest/sand-hills-state-forest-campsite-information/,Large waterfront site w/shelter on beautiful cypress lake; $15/night; Reservations by phone only. --AWH,lake,"34.5951,-79.9832",state,8.639279999999998,slightly warmer,137
843-498-6478,Sugarloaf Mountain Recreation Area site# SL 1A,SC,https://www.scfc.gov/state-lands/sand-hills-state-forest/sand-hills-state-forest-campsite-information/,"Large waterfront site w/shelter, picnic table, fireplace, trash can.
$15/night.
Reservations by phone only. --AWH",lake,"34.5909,-80.1289",state,8.167140000000003,slightly warmer,272
843-498-6478,Sugarloaf Mountain Recreation Area site# SL 1B,SC,https://www.scfc.gov/state-lands/sand-hills-state-forest/sand-hills-state-forest-campsite-information/,"Large waterfront site w/shelter, picnic table, fireplace, trash can.
$15/night.
Reservations by phone only. --AWH",lake,"34.5904,-80.1289",state,8.168039999999996,slightly warmer,272
843-498-6478,Sugarloaf Mountain Recreation Area site# SL 2,SC,https://www.scfc.gov/state-lands/sand-hills-state-forest/sand-hills-state-forest-campsite-information/,"Large waterfront site w/shelter, picnic table, fire ring, trash can.  Next to pier.
$15/night.
Reservations by phone only. --AWH",lake,"34.5905,-80.1267",state,8.144460000000002,slightly warmer,278
843-498-6478,Hunter Pond,SC,https://www.scfc.gov/state-lands/sand-hills-state-forest/sand-hills-state-forest-campsite-information/,"Large waterfront site, picnic table, trash can.  Near dock.
$10/night.
Reservations by phone only. --AWH",pond,"34.5691,-80.0820",state,8.218080000000004,slightly warmer,269
843-498-6478,Lee Pond,SC,https://www.scfc.gov/state-lands/sand-hills-state-forest/sand-hills-state-forest-campsite-information/,"Large waterfront site w/trash can.
$10/night.
Reservations by phone only. --AWH",pond,"34.5768,-80.0768",state,8.204220000000003,slightly warmer,269
843-498-6478,Sexton Pond,SC,https://www.scfc.gov/state-lands/sand-hills-state-forest/sand-hills-state-forest-campsite-information/,"Large waterfront site w/trash can.
$10/night.
Reservations by phone only. --AWH",pond,"34.4646,-80.3017",state,8.488080000000005,slightly warmer,246
,Bradbury Mountain State Park Campground,ME,,Mountain park with hiking trails but no significant water body; campground is not waterfront. --AWH,none,"43.9001,-70.1779",state,-8.612820000000005,slightly cooler,278
,Winslow Memorial Park,ME,"https://me-freeport.civicplus.com/245/Winslow-Park-Campground
https://secure.thinkreservations.com/freeportmaine/reservations",Freeport town campground directly on Luckse Sound --AWH,bay,"43.8015,-70.1153",local,-7.522739999999994,slightly cooler,22
,Fort Dummer State Park,VT,,The Connecticut River is in the area but the campground is set back on a hilltop; not riverfront. --AWH,none,"42.8246,-72.5666",state,-7.858619999999994,slightly cooler,610
,Spruce Run Recreation Area,NJ,,Campground on Spruce Run Reservoir with several lakefront RV sites.  Lakefront sites are clearly marked with blue icons on the reservation system map. --AWH,lake,"40.6605,-74.9389",state,-2.886839999999998,similar,308
,Belle Isle State Park,VA,"https://www.dcr.virginia.gov/state-parks/belle-isle
https://www.reservevaparks.com/Web/#!park/2",Park is on the Rappahannock River.  RV campground is not waterfront. --AWH,none,"37.7829,-76.5800",state,3.334140000000004,similar,16
,Kiptopeke State Park,VA,,Eastern Shore park on the Chesapeake Bay.  Campsites are not waterfront. --AWH,coastal woods,"37.1703,-75.9810",state,4.331520000000005,slightly warmer,45
,Keystone State Park,PA,,The park has Keystone Lake but the campground is in a standard wooded loop design set back from the lake. --AWH,none,"40.3726,-79.3850",state,-5.340419999999996,slightly cooler,1141
,Shawnee State Park,PA,,The park has Shawnee Lake but the campground is in a wooded area set back from the lake. --AWH,none,"40.0341,-78.6343",state,-4.801320000000004,slightly cooler,1161
,Santee State Park,SC,,"Many sites have a partial lake view through the cypress trees, but none of the sites are specifically lakefront
Many sites have a partial lake view through the cypress trees, but none of the sites are specifically lakefront. --AWH",none,"33.5188,-80.4884",state,10.553220000000003,warmer,144
