phone,name,state,website,note,waterfront,location,ownership,delta_temp,climate,elevation_feet
,Dames Ferry State Park,GA,"https://gastateparks.reserveamerica.com/camping/dames-ferry/r/campgroundDetails.do?contractCode=GA&parkId=535300
https://www.campsitephotos.com/campground/ga/dames-ferry/",Multiple waterfront sites on a peninsula in Lake Juliette.  --AWH,lake,"33.0405,-83.7592",state,10.349459999999999,warmer,442
,Hamburg State Park,GA,"https://gastateparks.reserveamerica.com/camping/hamburg-state-park/r/campgroundDetails.do?contractCode=GA&parkId=530165
https://www.campsitephotos.com/campground/ga/hamburg-state-park/",Multiple waterfront sites on a peninsula in Hamburg Mill Pond.  --AWH,lake,"33.2094,-82.7889",state,10.349639999999996,warmer,357
,Magnolia Springs State Park,GA,"https://gastateparks.reserveamerica.com/camping/magnolia-springs-state-park/r/campgroundDetails.do?contractCode=GA&parkId=530179
https://www.campsitephotos.com/campground/ga/magnolia-springs-state-park/","Campground on a Small Lake.  16 is the only waterfront site, but other sites may have a partial view of the lake.  --AWH",lake,"32.8834,-81.9530",state,11.509739999999997,warmer,196
,George L. Smith State Park,GA,https://gastateparks.reserveamerica.com/camping/george-l-smith-state-park/r/campgroundDetails.do?contractCode=GA&parkId=530161,Campground on a Cypress Pond.  Several sites are waterfront but cypress trees are thick near the shore.  --AWH,lake,"32.5500,-82.1239",state,12.051360000000006,warmer,213
,Laura S. Walker State Park,GA,"https://gastateparks.reserveamerica.com/camping/laura-s-walker-state-park/r/campgroundDetails.do?contractCode=GA&parkId=530177
https://www.campsitephotos.com/campground/ga/laura-s-walker-state-park/","Campground on Laura S. Walker Lake.  Sites 5, 6, 8, and 12 are waterfront.  --AWH",lake,"31.1411,-82.2157",state,14.926679999999998,much warmer,118
,Diamond Heritage Nature Sites (HipCamp),VA,,Electric and water.  $25/night plus HipCamp fees.  --AWH,none,"37.8599,-78.2282",private,1.9202399999999944,similar,374
,Lovers Lane Farm Stay (HipCamp),VA,,Private farm with camping area near attractive pond/lake.  No hookups.  $35/night plus HipCamp fees.  --AWH,pond,"38.1410,-78.2155",private,0.7590600000000034,similar,557
,Fauquier Horse & Campground (HipCamp),VA,,Private horse farm with camping area alonside attractive pond/lake.  No hookups.  $50/night plus HipCamp fees.  --AWH,pond,"38.6723, -77.7843",private,0.0835200000000004,similar,479
,North Mountain Campsite (HipCamp),VA,,"Camp high atop North Mountain at nearly 2,400 feet.  Summer foliage limits direct views, but the drive and nearby ridgeline provide spectacular overlooks.  No hookups.  $30/night plus hipcamp fees.  --AWH",none,"39.1941, -78.3697",private,-7.3609199999999975,slightly cooler,2303
,Oregon Inlet Campground,NC,"https://www.recreation.gov/camping/campgrounds/251431
https://www.campsitephotos.com/campground/nc/oregon-inlet/",Some sites are oceanfront but view and access may be blocked by dunes.  --AWH,coastal dunes,"35.7991,-75.5448",federal,6.940079999999996,slightly warmer,6
,Watermelon Park & RV Campground,VA,https://watermelonpark.com/,"Waterfront sites are available to long term campers only.  $65/night for a non-waterfront electric spot, 2 adults.  Additional adult +$10.  --AWH",none,"39.0963,-77.9378",private,-0.4573799999999987,similar,416
,Sweetwater Vacation Properties,VA,http://www.sweetwatervacationproperties.com/,$75/night (incl. tax/fees) for a riverfront spot w/full hookups  --AWH,river,"38.7740,-78.4087",private,-0.6611400000000014,similar,636
,Low Water Bridge Campground,VA,https://lowwaterbridgecampground.com/,"$50/night (incl. tax/fees) for a primitive riverfront spot, 2 adults.  Additional adult +$12.  Electric site +$10.  --AWH",river,"38.8419,-78.3288",private,-0.46746000000000437,similar,547
,River's Edge Campground,VA,https://www.campriversedgeva.com/,$62/night (incl. tax/fees) for a riverfront spot w/full hookups  --AWH,river,"38.7472,-78.9217",private,-3.1049999999999986,similar,1335
,Larry and Penny Thompson Memorial Park and Campground,FL,https://www.miamidade.gov/parks/larry-penny.asp,"Recommended by Grok as a good stopping point on the way to Key West that avoids downtown Miami.  The nearby zoo has a lake, but the campground is not lakefront.  --AWH",none,"25.6016,-80.3946",local,25.17858,hot,39
,Lily Bay State Park,ME,"https://www.campwithme.com/
https://cg-public-prod.web.maine.gov/public/index",Recommended by Grok as one of the best campgrounds in Maine.  Some campsites are lakefront.  --AWH,lake,"45.5716,-69.5462",state,-14.417819999999994,much cooler,1063
,Cobscook Bay State Park,ME,"https://www.campwithme.com/
https://cg-public-prod.web.maine.gov/public/index",Recommended by Grok as one of the best campgrounds in Maine.  Many campsites are lakefront.  --AWH,bay,"44.8404,-67.1500",state,-9.369360000000004,cooler,16
,Sebago Lake State Park,ME,"https://www.campwithme.com/
https://cg-public-prod.web.maine.gov/public/index",Recommended by Grok as one of the best campgrounds in Maine.  Some campsites appear to be lakefront.  --AWH,lake,"43.9312,-70.5800",state,-8.785799999999995,slightly cooler,311
802-289-0970,Hancock Campground,NH,"https://www.fs.usda.gov/r09/whitemountain/recreation/hancock-campground
https://www.recreation.gov/camping/campgrounds/10300159","Wooded sites along the Pemigewasset River, some of which are right on the water's edge.  Reservations website does not properly distinguish between tent-only and RV sites.  Call the campground to clarify.  --AWH",river,"44.0637,-71.5942",federal,-12.042899999999994,cooler,1158
,Moosalamoo Campground,VT,"https://www.fs.usda.gov/r09/gmfl/recreation/moosalamoo-campground
https://www.recreation.gov/camping/campgrounds/256347",19 tent and RV sites.  Max vehicle length 20 feet.  --AWH,none,"43.9188,-73.0272",federal,-13.326479999999995,cooler,1591
,Mongaup Pond Campground,NY,"https://dec.ny.gov/places/mongaup-pond-campground-and-day-use-area
https://newyorkstateparks.reserveamerica.com/camping/mongaup%20pond/r/campgroundDetails.do?contractCode=NY&parkId=100","Located in the Catskills, many RV sites right on the lake.  --AWH",lake,"41.9574,-74.6907",state,-11.843459999999999,cooler,2165
,North-South Lake Campground,NY,"https://dec.ny.gov/places/north-south-lake-campground-and-day-use-area
https://newyorkstateparks.reserveamerica.com/camping/north-south%20lake%20campground/r/campgroundDetails.do?contractCode=NY&parkId=5",The highest-elevation state campground in the Catskills.  Some campsites are on the lake.  --AWH,lake,"42.2003,-74.0416",state,-12.280679999999997,cooler,2165
,Cataloochee Campground,NC,"https://www.nps.gov/grsm/planyourvisit/cataloochee-campground.htm
https://www.recreation.gov/camping/campgrounds/233284?tab=info",Great Smoky Mountains National Park; in a high valley surrounded by even higher mountain peaks; 27 sites for tents and RVs.  --AWH,none,"35.6319,-83.0855",federal,-2.586960000000003,similar,2762
,Balsam Mountain Campground,NC,"https://www.nps.gov/grsm/planyourvisit/balsam-mountain.htm
https://www.recreation.gov/camping/campgrounds/273848?src=widget","High-elevation ridge campground in Great Smoky Mountains National Park; temperatures rarely exceed 70 degrees.  Steep, winding access road.  --AWH",none,"35.5647,-83.1737",federal,-11.697300000000004,cooler,5351
,Rock Creek Recreation Area,TN,"https://www.fs.usda.gov/r08/cherokee/recreation/rock-creek-recreation-area
https://www.recreation.gov/camping/campgrounds/267551?tab=info",Cherokee National Forest; small pond nearby.  --AWH,none,"36.1379,-82.3508",federal,-1.9884600000000028,similar,2339
,Dennis Cove Recreation Area,TN,"https://www.fs.usda.gov/r08/cherokee/recreation/dennis-cove-recreation-area
https://www.recreation.gov/camping/campgrounds/251724?tab=info",Cherokee National Forest; at least a few campsites in this small campground are situated directly along Laurel Creek.  --AWH,creek,"36.2568,-82.1132",federal,-3.290579999999997,similar,2644
,Cardens Bluff Campground,TN,"https://www.fs.usda.gov/r08/cherokee/recreation/cardens-bluff-campground
https://www.recreation.gov/camping/campgrounds/122390",Cherokee National Forest; site 29 is the only RV site on the Lake.  --AWH,lake,"36.3109,-82.1188",federal,-0.9543599999999932,similar,1962
,Little Oak Campground,TN,"https://www.fs.usda.gov/r08/cherokee/recreation/little-oak-campground
https://www.recreation.gov/camping/campgrounds/122240","Cherokee National Forest; multiple RV sites right on South Holston Lake, including 26 and 47.  --AWH",lake,"36.5156,-82.0520",federal,-1.205819999999998,similar,1929
,Jacobs Creek Recreation Area,VA,"https://www.fs.usda.gov/r08/cherokee/recreation/jacobs-creek-recreation-area
https://www.recreation.gov/camping/campgrounds/10128487","Cherokee National Forest; multiple RV sites right on South Holston Lake, including 22 and 27.  --AWH",lake,"36.5635,-82.0063",federal,-0.7538399999999953,similar,1778
,Backbone Rock Campground,TN,"https://www.fs.usda.gov/r08/cherokee/recreation/backbone-rock-recreation-area
https://www.recreation.gov/camping/campgrounds/251757",Sites are directly alongside Beaverdam Creek in a narrow gorge in Cherokee National Forest.  Access to creek may be overgrown in the summertime.  --AWH,creek,"36.5968,-81.8215",federal,-3.282480000000003,similar,2470
,Curtis Creek Campground,NC,"https://www.fs.usda.gov/r08/northcarolina/recreation/curtis-creek-campground
https://www.recreation.gov/camping/campgrounds/251469","Pisgah National Forest; A couple of RV sites appear to be creekside, but access to the creek may be overgrown in the summertime..  --AWH",creek,"35.6895,-82.1995",federal,0.2460599999999957,similar,1939
,Carolina Hemlocks Recreation Area,NC,"https://www.fs.usda.gov/r08/northcarolina/recreation/carolina-hemlocks-recreation-area
https://www.recreation.gov/camping/campgrounds/233954",Sites are arranged along the South Toe River in Pisgah National Forest; some RV sites have direct river access.  --AWH,river,"35.8045,-82.2074",federal,-3.0614399999999953,similar,2808
,Linville Falls Campground,NC,"https://www.nps.gov/blri/planyourvisit/linville-falls-cg.htm
https://www.recreation.gov/camping/campgrounds/234036",High-elevation Blue Ridge Parkway campground on a ridge near the falls trailhead.  --AWH,none,"35.9685,-81.9419",federal,-5.322239999999997,slightly cooler,3359
,Mortimer Campground,NC,"https://www.fs.usda.gov/r08/northcarolina/recreation/mortimer-campground
https://www.recreation.gov/camping/campgrounds/10046915",Pisgah National Forest near Grandfather Mountain  --AWH,none,"35.9924,-81.7632",federal,0.5666399999999944,similar,1696
,Julian Price Campground,NC,https://www.nps.gov/blri/planyourvisit/price-cg.htm,"High-elevation Blue Ridge Parkway campground on Price Lake; a few sites in the A loop are waterfront and will accomodate small RVs, including sites A11 and A25.  --AWH",lake,"36.1392,-81.7387",federal,-6.003900000000004,slightly cooler,3464
,Warrior Creek Campground,NC,"https://www.saw.usace.army.mil/Locations/District-Lakes-and-Dams/W-Kerr-Scott/Recreation/Recreation-Areas/
https://www.recreation.gov/camping/campgrounds/233665","USACE campground in W. Kerr Scott Reservoir area.  A few sites are on a little pond, but none of the sites appear to be on the reservoir.  --AWH",pond,"36.1010,-81.2884",federal,2.360160000000002,similar,1138
,Fort Hamby Park,NC,"https://www.saw.usace.army.mil/Locations/District-Lakes-and-Dams/W-Kerr-Scott/Recreation/Recreation-Areas/
https://www.recreation.gov/camping/campgrounds/234253",USACE campground on W. Kerr Scott Reservoir with a few lakefront sites.  --AWH,lake,"36.1296,-81.2746",federal,2.0278799999999944,similar,1217
,Doughton Park Campground,NC,https://www.nps.gov/blri/planyourvisit/doughton-park-cg.htm,High-elevation Blue Ridge Parkway campground on a mountain ridge.  --AWH,none,"36.4288,-81.1597",federal,-6.653880000000004,slightly cooler,3500
,Rocky Knob Recreation Area,VA,https://www.nps.gov/blri/planyourvisit/rocky-knob-cg.htm,Blue Ridge Parkway campground on a mountain ridge.  --AWH,none,"36.8030,-80.3518",federal,-3.8993399999999947,similar,2539
,Peaks Of Otter Campground,VA,https://www.nps.gov/blri/planyourvisit/peaks-otter-cg.htm,Blue Ridge Parkway campground near Peaks of Otter Lake.  Campsites are not waterfront.  --AWH,none,"37.4424,-79.6087",federal,-5.307659999999998,slightly cooler,2611
,Otter Creek Campground,VA,https://www.nps.gov/blri/planyourvisit/otter-creek-cg.htm,Blue Ridge Parkway campground near Otter Creek.  Campsites are not waterfront.  --AWH,none,"37.5762,-79.3389",federal,0.8280000000000002,similar,823
,Piney Mountain campsites,MD,"https://dnr.maryland.gov/forests/Pages/publiclands/PotomacGarrett/Camping.aspx
https://freecampsites.net","Potomac-Garrett State Forest, 10 dispersed campsites along Piney Mountain road.  Self-registration kiosk on Piney Mountain road near Sang Run road.  $10 per night.  --AWH",none,"39.5515,-79.4630",state,-10.040039999999996,cooler,2874
,Snaggy Mountain campsites,MD,"https://dnr.maryland.gov/forests/Pages/publiclands/PotomacGarrett/Camping.aspx
https://freecampsites.net","Potomac-Garrett State Forest, 10 dispersed campsites along Snaggy Mountain road between Cranesville road and Sanders lane.  Self-registration kiosk on Snaggy Mountain road near Cranesville road.  $10 per night.  --AWH",none,"39.4981,-79.4541",state,-8.820720000000001,slightly cooler,2559
,Lostland Run campsites,MD,"https://dnr.maryland.gov/forests/Pages/publiclands/PotomacGarrett/Camping.aspx
https://freecampsites.net","Potomac-Garrett State Forest, 5 dispersed campsites along Lostland Run road leading to north branch of Potomac River.  Self-registration kiosk on Lost Land Run road near Potomac Camp road.  $10 per night.  --AWH",none,"39.3818,-79.2772",state,-8.178479999999997,slightly cooler,2437
,Wallman/Laurel Run campsites,MD,"https://dnr.maryland.gov/forests/Pages/publiclands/PotomacGarrett/Camping.aspx
https://freecampsites.net","Potomac-Garrett State Forest, 14 dispersed campsites along Wallman and Laurel Run roads leading to north branch of Potomac River.  Self-registration kiosk at 15 Laurel Run.  $10 per night.  --AWH",none,"39.3407,-79.2960",state,-8.736299999999996,slightly cooler,2614
,FR92 Roadside Site,VA,https://freecampsites.net,Alongside FR92 is a narrow lane with two camping places.  The first is accessible to almost any vehicle.  The second would probably require a 4WD.  --AWH,none,"38.9374,-78.6425",federal,-4.710959999999994,slightly cooler,1689
,Columbia Furnace Boondock,VA,https://freecampsites.net,Large gravel lot owned by the forest service. Likely fits 5+ large RVs. Very friendly forest rangers and completely legal. Lots of smaller campsites along the main forest road.  --AWH,none,"38.9147,-78.6272",federal,-4.2606000000000055,slightly cooler,1574
,Red Bridge Campground,PA,"https://thedyrt.com/press/2025-best-places-to-camp-in-the-northeast-region/
https://www.recreation.gov/camping/campgrounds/232088",Allegheny National Forest campground on the Allegheny River.  Some sites are riverfront.  --AWH,river,"41.7788,-78.8884",state,-8.725679999999993,slightly cooler,1381
,Town Hall Road Dispersed Sites,NH,https://thedyrt.com/camping/new-hampshire/town-hall-road-free-camping,Roadside dispersed sites along Slippery Brook in the White Mountain National Forest; most are directly on the river and some will accomodate small RVs.  --AWH.,none,"44.1613,-71.0950",federal,-13.002479999999997,cooler,1378
,Meriwether Lewis Campground,TN,https://thedyrt.com/press/2025-best-places-to-camp-in-the-southeast-region/,Natchez Trace Parkway campground in a wooded loop; sites are first-come-first-served.  --AWH,none,"35.5232,-87.4570",federal,4.4180999999999955,slightly warmer,853
,River Run Campground,WV,https://thedyrt.com/press/2025-best-places-to-camp-in-the-southeast-region/,Part of North Bend State Park.  Several sites are right on the river.  --AWH,river,"39.2212,-81.1094",state,-2.4606000000000057,similar,915
,Blue Heron Campground,AR,https://thedyrt.com/press/2025-best-places-to-camp-in-the-southeast-region/,Ozark Mountain hideaway offers premium riverfront sites with full hookups for $65-$80/night.  --AWH,river,"36.2845,-92.5302",private,4.521959999999997,slightly warmer,439
864-944-2639,Devils Fork State Park Campground,SC,"https://southcarolinaparks.com/devils-fork/camping
https://www.campsitephotos.com/campground/sc/devils-fork-state-park/","Many waterfront RV sites on Lake Jocassee.  To reserve a single night, call the campground directly within one week of arrival.  --AWH",lake,"34.9528,-82.9515",state,4.4971199999999945,slightly warmer,1118
,002 Fireline,PA,https://pennsylvaniastateparks.reserveamerica.com/,"Pinchot State Forest
Dispersed campsite on a forested ridge in Pinchot State Forest; no water body adjacent.",none,"41.2064,-75.6152",state,-9.216360000000005,cooler,1807
,Manny Gordon 001,PA,https://pennsylvaniastateparks.reserveamerica.com/,"Pinchot State Forest
Dispersed campsite in forested upland area of Pinchot State Forest; no water body adjacent.",none,"41.2068,-75.6120",state,-9.146880000000001,cooler,1788
,Manny Gordon 002,PA,https://pennsylvaniastateparks.reserveamerica.com/,"Pinchot State Forest
Dispersed campsite in forested upland area of Pinchot State Forest; no water body adjacent.",none,"41.2059,-75.6115",state,-9.13356,cooler,1784
,Manny Gordon 003,PA,https://pennsylvaniastateparks.reserveamerica.com/,"Pinchot State Forest
Dispersed campsite in forested upland area of Pinchot State Forest; no water body adjacent.",none,"41.2055,-75.6105",state,-9.132840000000002,cooler,1784
,32 Homestead Lane,PA,,Private property in an inland area; not directly on a water body.,none,"40.2174,-75.5643",private,-1.890359999999996,similar,252
,Braley Pond dispersed campsites,VA,https://tmbtent.com/virginia-free-dispersed-camping/,"Dispersed sites can be found along the road before reaching the pond, and more are located past the pond along the turnaround area. Camping is not allowed near the pond, although campers may use the vault toilet there.",none,"38.2914,-79.3051",federal,-4.800060000000005,slightly cooler,2040
,Hone Quarry Ridge Campsite,WV,,High-elevation campsite at Flagpole rd & Hone Quarry Ridge trail,none,"38.4880,-79.2149",federal,-11.70594,cooler,3878
,Long Run Road Campsite #4,WV,,Unverified high-elevation dispersed site; road may require 4WD.  --AWH,none,"38.6424,-79.0847",federal,-10.860660000000003,cooler,3563
,Long Run Road Campsite #5,WV,,Unverified high-elevation dispersed site; road may require 4WD.  --AWH,none,"38.6455,-79.0823",federal,-10.772639999999997,cooler,3536
,Long Run Road campsite #6,WV,,Unverified high-elevation dispersed site; road may require 4WD.  --AWH,none,"38.6514,-79.0837",federal,-10.666260000000003,cooler,3504
,Gandy Creek dispersed camping,WV,"https://thedyrt.com/camping/west-virginia/gander-creek-dispersed-camping
https://www.purplelizard.com/blogs/news/car-camping-and-single-track-adventures-in-gandy-creek",About three high-elevation dispersed RV campsites (and many more tent sites) along Gandy Creek.  RV sites are almost always occupied in good weather.  No cell service in this remote area.  --AWH,creek,"38.7664,-79.5778",federal,-9.703259999999995,cooler,3176
,Swallow Rock Campground,WV,https://thedyrt.com/camping/west-virginia/west-virginia-swallow-rock,Small high-elevation camping spot that is part of the Gandy Creek Dispersed Camping area; sites are directly along Gandy Creek.  --AWH,creek,"38.7701,-79.5556",federal,-9.674819999999999,cooler,3166
,Red Creek Campground,WV,"https://www.fs.usda.gov/r09/monongahela/recreation/red-creek-campground
https://thedyrt.com/camping/west-virginia/west-virginia-red-creek
https://www.campsitephotos.com/campground/wv/red-creek/","Small high-elevation first-come-first-served USFS campground in the Dolly Sods area.  Almost always full on weekends and in nice weather.  $11/night as of 2026, cash only, exact change.  --AWH",none,"39.0323,-79.3159",federal,-12.673979999999998,cooler,3874
,Spruce Knob Lake Campground,WV,"https://www.recreation.gov/camping/campgrounds/234132
https://thedyrt.com/camping/west-virginia/west-virginia-spruce-knob-lake","High-elevation campground near Spruce Knob.  There is a lake nearby, but the campground is not lakefront.  --AWH",none,"38.7076,-79.5878",federal,-12.69792,cooler,4045
,New Germany State Park Campground,MD,https://parkreservations.maryland.gov,"A few sites may be large enough for a camper van.  There is a lake in the park, but the campground is not lakefront.",none,"39.6346,-79.1187",state,-9.124919999999998,cooler,2575
,St. John's Rock Campsites,MD,https://parkreservations.maryland.gov,"Part of Savage River State Forest
Savage River State Forest site on elevated terrain; not directly on a water body.",none,"39.6603,-78.9656",state,-9.896579999999998,cooler,2779
,SH001 Town Hill,MD,https://pennsylvaniastateparks.reserveamerica.com/,"secluded site with road noise from I-70
Buchanan State Forest
SH001 Town Hill",none,"39.8539,-78.2722",state,-5.974560000000005,slightly cooler,1581
,CV021 326 Lot,PA,https://pennsylvaniastateparks.reserveamerica.com/,"Buchanan State Forest
CV021 326 Lot
Dispersed campsite on a forested lot in Buchanan State Forest; no water body adjacent.",none,"39.8734,-78.5091",state,-7.799759999999993,slightly cooler,2083
,CV014 Nester Lot,PA,https://pennsylvaniastateparks.reserveamerica.com/,"Buchanan State Forest
CV014 Nester Lot
Dispersed campsite on a forested lot in Buchanan State Forest; no water body adjacent.",none,"39.8614,-78.5290",state,-8.573760000000005,slightly cooler,2306
,CV013 Refuge Trail ATV,PA,https://pennsylvaniastateparks.reserveamerica.com/,"Buchanan State Forest
CV013 Refuge Trail ATV
Dispersed campsite along an ATV trail in Buchanan State Forest; no water body adjacent.",none,"39.8581,-78.5447",state,-7.666919999999999,slightly cooler,2053
,CV011 Martin Hill North,PA,https://pennsylvaniastateparks.reserveamerica.com/,"Buchanan State Forest
CV011 Martin Hill North
Dispersed campsite on Martin Hill in Buchanan State Forest; no water body adjacent.",none,"39.8605,-78.5638",state,-7.682940000000003,slightly cooler,2057
,CV008 Oak Trail,PA,https://pennsylvaniastateparks.reserveamerica.com/," large grassy private lot
Buchanan State Forest
CV008 Oak Trail
Dispersed campsite in Buchanan State Forest; no water body adjacent.",none,"39.8545,-78.5776",state,-8.409240000000002,slightly cooler,2263
,CV006 Tower Lot,PA,https://pennsylvaniastateparks.reserveamerica.com/,"Buchanan State Forest
CV006 Tower Lot",none,"39.8307,-78.5441",state,-10.0044,cooler,2723
,CV007 Blankley Road West,PA,https://pennsylvaniastateparks.reserveamerica.com/,"Buchanan State Forest
Site CV007 ""Blankley Road West""
Dispersed campsite along Blankley Road in Buchanan State Forest; no water body adjacent.",none,"39.8318,-78.5946",state,-7.865280000000002,slightly cooler,2122
,Big Flat Parking Area,PA,,"8 drive up campsites available by reservation
Drive-up campsites in Michaux State Forest; no water body adjacent.",none,"39.9878,-77.4013",state,-7.66638,slightly cooler,1988
,Site 009 Haunted Hollow,PA,,Dispersed campsite in state forest; no water body adjacent.,none,"39.9700,-77.4698",state,-7.774739999999997,slightly cooler,2027
,Forbes Motorized Campsite #5,PA,,Dispersed motorized campsite in Forbes State Forest on forested mountain terrain; no water body adjacent.,none,"39.9818,-79.2939",state,-9.11808,cooler,2398
,Forbes State Forest Motorized Site 2,PA,,Dispersed motorized campsite in Forbes State Forest; no water body adjacent.,none,"40.1083,-79.1953",state,-10.773179999999998,cooler,2798
,Forbes State Forest Motorized Camping #1,PA,,Dispersed motorized campsite in Forbes State Forest; no water body adjacent.,none,"40.1305,-79.1821",state,-10.485539999999997,cooler,2706
,Kooser State Park,PA,,"Kooser Lake is in the park for swimming but the campground is set back in the woods, not directly lakefront.",none,"40.0602,-79.2325",state,-9.832500000000003,cooler,2559
,Forbes State Forest Campsite #3,PA,,"small spring-fed pond nearby
Note mentions a small spring-fed pond nearby, but 'nearby' does not mean the site is directly on the pond.",none,"39.8022,-79.6784",state,-9.192599999999997,cooler,2509
,Forbes Campsite #4,PA,,Dispersed campsite in Forbes State Forest; no water body adjacent.,none,"39.7980,-79.6473",state,-7.851240000000002,slightly cooler,2135
,Forbes State Forest Motorized Site 6,PA,,Dispersed motorized campsite in Forbes State Forest; no water body adjacent.,none,"39.7915,-79.1549",state,-10.811339999999998,cooler,2969
,Deep Creek Lake State Park,MD,https://parkreservations.maryland.gov,"There is a lake in the park, but the campground is not lakefront.",none,"39.5244,-79.3006",state,-10.27206,cooler,2952
,Stuart Recreation Area,WV,,USFS campground in the vicinity of the Greenbrier River but sites are not confirmed to be directly on the river.,none,"38.9187,-79.7729",federal,-6.923700000000001,slightly cooler,2319
,Bear Heaven Campground,WV,,"High-elevation campground.  Not specifically designed for RVs, but online videos suggest that at least a few of the sites should be able to accommodate a camper van.",none,"38.9315,-79.6807",federal,-11.66184,cooler,3641
,Mathews Arm Campground,VA,"https://www.recreation.gov/camping/campgrounds/232432
https://www.campsitephotos.com/campground/va/mathews-arm/",Northernmost campground in Shenandoah National Park.  --AWH,none,"38.7624,-78.2966",federal,-8.22186,slightly cooler,2762
,Sleepy Hollow Campground,MD,,", private campground, $40/night incl fees.
Private campground in western Maryland; no specific water body adjacent.",none,"39.6390,-79.1112",private,-9.273240000000005,cooler,2614
