name,location,waterfront,state,website,note,ownership,delta_temp,climate,elevation_feet
Pound River Campground,"37.1965,-82.4402",river,VA,"https://www.recreation.gov/camping/campgrounds/251949
https://www.campsitephotos.com/campground/va/pound-river-va/",Campground southwestern Virginia with multiple RV sites right on the Pound River.  --AWH,private,-0.7466400000000001,similar,1456
Mohican State Park Campground,"40.6096,-82.2576",none,OH,,"Sites are out in the open, but the park is worth seeing.
Recommended in _Where_Should_We_Camp_Next?_ by Stephanie Puglisi
Campground is on a hilltop/plateau area; the Clear Fork of the Mohican River runs through the park's gorge below.",state,-5.006520000000001,slightly cooler,928
Old Man's Cave Campground,"39.4375,-82.5381",none,OH,,"Recommended in _Where_Should_We_Camp_Next?_ by Stephanie Puglisi
Hocking Hills State Park campground on a hilltop above the gorge; not directly on a water body.",state,-2.9084399999999997,similar,931
Ludington State Park and Campgrounds,"44.0515,-86.4945",coastal woods,MI,,"Recommended in _Where_Should_We_Camp_Next?_ by Stephanie Puglisi
Multiple loops nestled in coastal woodland at the confluence of Lake Michigan, Big Sable River, and Hamlin Lake, but no sites are actually on the water.  --AWH",state,-10.148939999999996,cooler,633
Lower Falls Portage Campground,"46.6032,-85.1979",river,MI,,"Recommended in _Where_Should_We_Camp_Next?_ by Stephanie Puglisi
Small campground at Tahquamenon Falls State Park with sites directly along the Tahquamenon River near the portage route.",federal,-14.7537,much cooler,636
Platte River Campground,"44.7156,-86.1160",none,MI,,"Recommended in _Where_Should_We_Camp_Next?_ by Stephanie Puglisi
NPS campground in Sleeping Bear Dunes National Lakeshore.  Sites are not waterfront.  --AWH",federal,-11.250720000000003,cooler,606
Reelfoot State Park Campground,"36.3542,-89.3962",lake,TN,,"Recommended in _Where_Should_We_Camp_Next?_ by Stephanie Puglisi
Campground on Reelfoot Lake with waterfront sites offering direct lake access.  --AWH",state,4.8762000000000025,slightly warmer,305
Smokemont Campground,"35.5592,-83.3118",creek,NC,"https://www.recreation.gov/camping/campgrounds/232486
https://www.campsitephotos.com/campground/nc/smokemont/","Recommended in _Where_Should_We_Camp_Next?_ by Stephanie Puglisi
Great Smoky Mountains campground on Bradley Fork creek.  Some sites in the F loop are right on the creek.  --AWH",federal,-0.8297999999999942,similar,2306
Mammoth Cave Campground,"37.1820,-86.0968",none,KY,,"Recommended in _Where_Should_We_Camp_Next?_ by Stephanie Puglisi
Campground is on a ridgetop above the Green River; the river runs through the park below but the campground is in an upland forested area.",federal,1.6662599999999963,similar,787
Wax Campground,"37.3452,-86.1272",lake,KY,,"Recommended in _Where_Should_We_Camp_Next?_ by Stephanie Puglisi
USACE campground on Nolin River Lake with lakefront campsites.",federal,2.2383000000000033,similar,544
Cloudland Canyon State Park,"34.8395,-85.4840",none,GA,,"Recommended in _Where_Should_We_Camp_Next?_ by Stephanie Puglisi
Campground is on the canyon rim, not directly on any water body.",state,2.3727599999999986,similar,1771
Stone Mountain State Park,"36.3829,-81.0225",creek,NC,"https://northcarolinastateparks.reserveamerica.com/camping/stone-mountain-state-park/r/campgroundDetails.do?contractCode=NC&parkId=552862
https://www.campsitephotos.com/campground/nc/stone-mountain-state-park/","Recommended in _Where_Should_We_Camp_Next?_ by Stephanie Puglisi
Several sites are directly on Big Sandy Creek.  --AWH",state,-0.8031599999999987,similar,1883
Topsail Hill Preserve State Park,"30.3711,-86.2748",coastal woods,FL,https://thedyrt.com/press/2025-best-places-to-camp-in-the-southeast-region/,"Recommended in _Where_Should_We_Camp_Next?_ by Stephanie Puglisi
Campground is inland in a wooded area; the beach and Campbell Lake require a tram ride or walk.  --AWH",state,16.628580000000003,much warmer,29
Gunter Hill Campground,"32.3586,-86.4548",lake,AL,,"Recommended in _Where_Should_We_Camp_Next?_ by Stephanie Puglisi
USACE campground on the Alabama River/Woodruff Lake with waterfront sites on the reservoir.",federal,12.489479999999995,warmer,187
DeSoto State Park,"34.4971,-85.6273",none,AL,,"Recommended in _Where_Should_We_Camp_Next?_ by Stephanie Puglisi
The Little River runs through the park, but the main campground is on the plateau, not directly on the river.",state,3.562379999999995,similar,1610
Cheaha State Park,"33.4786,-85.8094",none,AL,,"Recommended in _Where_Should_We_Camp_Next?_ by Stephanie Puglisi
Mountaintop campground at the highest point in Alabama; no significant water frontage.",state,3.5119800000000008,similar,2139
Monte Sano State Park Campground,"34.7455,-86.5121",none,AL,,"Recommended in _Where_Should_We_Camp_Next?_ by Stephanie Puglisi
Campground is on a mountain plateau without waterfront access.",state,3.0801600000000007,similar,1620
Gulf State Park Campground,"30.2600,-87.6486",lake,AL,,"Recommended in _Where_Should_We_Camp_Next?_ by Stephanie Puglisi
Campground loops are arranged around Middle Lake with some sites directly on the lakeshore and a short walk to the gulf.  --AWH",state,16.86366,much warmer,19
Leonard Harrison campground,"41.6975,-77.4497",none,PA,,"Recommended in _Where_Should_We_Camp_Next?_ by Stephanie Puglisi
Campground is on the rim of Pine Creek Gorge, far above Pine Creek; not waterfront.",state,-10.322639999999996,cooler,1870
Woodford State Park,"42.8912,-73.0385",lake,VT,,"Recommended in _Where_Should_We_Camp_Next?_ by Stephanie Puglisi
Campground wraps around Adams Reservoir with multiple sites directly on the shoreline.",state,-14.144399999999996,much cooler,2339
George Washington State Campground and Management Area,"41.9220,-71.7550",pond,RI,,"Recommended in _Where_Should_We_Camp_Next?_ by Stephanie Puglisi
Campground has sites directly on Bowdish Reservoir.",state,-6.257339999999995,slightly cooler,616
Burlingame State Campgrounds,"41.3618,-71.7013",pond,RI,,"Recommended in _Where_Should_We_Camp_Next?_ by Stephanie Puglisi
Sites directly along the shore of Watchaug Pond.",state,-3.435480000000004,similar,108
Ellacoya State Park,"43.5737,-71.3544",lake,NH,,"Recommended in _Where_Should_We_Camp_Next?_ by Stephanie Puglisi
Small state park directly on the shore of Lake Winnipesaukee with RV sites adjacent to the beach/lake.",state,-8.867700000000005,slightly cooler,515
Beartown State Forest,"42.2334,-73.2746",pond,MA,,"Limited number of RV spots.  $40 non-resident.  Recommended in _Where_Should_We_Camp_Next?_ by Stephanie Puglisi
Campground sites along the shore of Benedict Pond.",state,-10.947960000000005,cooler,1775
Schoodic Woods Campground,"44.3814,-68.0644",coastal woods,ME,"https://www.nps.gov/acad/planyourvisit/schoodic-woods-campground.htm
https://www.recreation.gov/camping/campgrounds/251833
https://thedyrt.com/camping/maine/schoodic-woods-campground",Recommended in _Where_Should_We_Camp_Next?_ by Stephanie Puglisi,federal,-9.16326,cooler,190
Camden Hills State Park,"44.2311,-69.0483",coastal woods,ME,,"Recommended in _Where_Should_We_Camp_Next?_ by Stephanie Puglisi
Park is on the bay but campsites do not appear to be waterfront",state,-8.998019999999997,slightly cooler,219
Black Rock State Park,"41.6469,-73.0967",none,CT,,"Recommended in _Where_Should_We_Camp_Next?_ by Stephanie Puglisi
Campground sites are in a wooded area set back from Black Rock Pond; the pond has a swimming area but campsites are not directly on it.",state,-5.036760000000005,slightly cooler,413
Hammonasset Beach State Park,"41.2667,-72.5584",coastal woods,CT,,"Recommended in _Where_Should_We_Camp_Next?_ by Stephanie Puglisi
Connecticut's largest shoreline park on Long Island Sound; Large campground roughly a half-mile from the beach in a semi-wooded grassy area.  --AWH",state,-2.9016,similar,6
Watkins Glen State Park Six Nations Camping Area,"42.3705,-76.8824",none,NY,,"Recommended in _Where_Should_We_Camp_Next?_ by Stephanie Puglisi
Campground is on a hilltop above the gorge; Seneca Lake is nearby but the campground is not waterfront.",state,-8.375039999999998,slightly cooler,984
Letchworth State Park Campground,"42.6975,-77.9373",none,NY,,"Recommended in _Where_Should_We_Camp_Next?_ by Stephanie Puglisi
Campground is on the plateau above the Genesee River gorge; the park is famous for waterfalls but the campground is not on the river.",state,-8.717939999999995,slightly cooler,915
Killens Pond State Park Campground,"38.9745,-75.5350",none,DE,,"There is a pond in the park, but the campground is not waterfront.  Recommended in _Where_Should_We_Camp_Next?_ by Stephanie Puglisi",state,1.0956600000000019,similar,42
Tygart Lake State Park,"39.2802,-80.0108",none,WV,,"The park is on a lake, but the campground is not.",state,-3.409200000000001,similar,1151
North Creek Campground,"37.5419,-79.5834",creek,VA,https://www.fs.usda.gov/r08/gwj/recreation/north-creek-campground,Small first-come-first-served USFS campground in the George Washington National Forest with sites positioned directly along North Creek.  --AWH,federal,-0.3504599999999966,similar,1171
Cave Mountain Lake Family Camp,"37.5757,-79.5346",none,VA,"https://www.recreation.gov/camping/campgrounds/233397
https://www.campsitephotos.com/campground/va/cave-mountain-lake/","There is a small lake nearby, but the campground is not on the lake.  --AWH",federal,-0.7037999999999957,similar,1253
Sherando Lake Recreation Area,"37.9195,-79.0073",none,VA,"https://www.recreation.gov/camping/campgrounds/234688
https://www.campsitephotos.com/campground/va/sherando-lake/","There are two small lakes nearby, but the campground is not on the lake.  --AWH",federal,-3.5573399999999986,similar,1880
Campground at James Island County Park,"32.7369,-79.9924",none,SC,"https://charlestoncountyparks.reserveamerica.com/camping/the-campground-at-james-island-county-park/r/campgroundDetails.do?contractCode=CHST&parkId=1240020
https://www.campsitephotos.com/campground/sc/james-island-county-park/","Recommended in _Where_Should_We_Camp_Next?_ by Stephanie Puglisi
Large campground in the interior of the park; while the park is on an island with marsh areas, the campground is not directly waterfront.  --AWH",local,12.440340000000003,warmer,9
Paris Mountain State Park Campground,"34.9251,-82.3744",none,SC,https://reserve.southcarolinaparks.com/paris-mountain,"Recommended in _Where_Should_We_Camp_Next?_ by Stephanie Puglisi
Campground is in a wooded area on the mountain; the park's lakes are separate from the camping area.  To reserve a single night, call the campground at 864 244-5565 within one week of arrival.  --AWH",state,4.6639800000000005,slightly warmer,1086
Canaan Loop Road dispersed campsite #1,"39.0889,-79.4531",none,WV,https://www.fs.usda.gov/r09/monongahela/recreation/canaan-mountain-backcountry,"High-elevation heavily-wooded back-in site with a fairly level parking area.  Stopped here briefly on the morning of April 6, 2025 and had dinner here on the evening of November 8, 2025.  --AWH",federal,-12.214260000000005,cooler,3717
Canaan Loop Road dispersed campsite #2,"39.0846,-79.4591",none,WV,https://www.fs.usda.gov/r09/monongahela/recreation/canaan-mountain-backcountry,High-elevation dispersed site on the Canaan Loop Road in the Monongahela National Forest.  --AWH,federal,-12.218220000000002,cooler,3720
Canaan Loop Road dispersed campsite #3,"39.0818,-79.4625",none,WV,https://www.fs.usda.gov/r09/monongahela/recreation/canaan-mountain-backcountry,High-elevation dispersed site on the Canaan Loop Road in the Monongahela National Forest.  --AWH,federal,-12.189780000000003,cooler,3714
Canaan Loop Road dispersed campsite #4,"39.0776,-79.4666",none,WV,https://www.fs.usda.gov/r09/monongahela/recreation/canaan-mountain-backcountry,High-elevation dispersed site on the Canaan Loop Road in the Monongahela National Forest.  --AWH,federal,-12.205619999999994,cooler,3720
Canaan Loop Road dispersed campsite #5,"39.0726,-79.4732",none,WV,https://www.fs.usda.gov/r09/monongahela/recreation/canaan-mountain-backcountry,"Small high-elevation site right along the side of the road with almost no trees and a big view of sky.  Camped here on November 8, 2025.  --AWH",federal,-11.939220000000002,cooler,3648
Canaan Loop Road dispersed campsite #6,"39.0722,-79.4736",none,WV,https://www.fs.usda.gov/r09/monongahela/recreation/canaan-mountain-backcountry,"Medium-sized high-elevation site with almost no trees and a big view of the sky.  Camped here on April 5, 2025.  --AWH",federal,-11.938500000000005,cooler,3648
Canaan Loop Road dispersed campsite #7,"39.0693,-79.4767",none,WV,https://www.fs.usda.gov/r09/monongahela/recreation/canaan-mountain-backcountry,High-elevation dispersed site on the Canaan Loop Road in the Monongahela National Forest.  --AWH,federal,-12.167279999999996,cooler,3714
Canaan Loop Road dispersed campsite #8,"39.0680,-79.4854",none,WV,https://www.fs.usda.gov/r09/monongahela/recreation/canaan-mountain-backcountry,High-elevation dispersed site on the Canaan Loop Road in the Monongahela National Forest.  --AWH,federal,-11.895839999999996,cooler,3638
Canaan Loop Road possible dispersed campsite,"39.0643,-79.5059",creek,WV,https://www.fs.usda.gov/r09/monongahela/recreation/canaan-mountain-backcountry,Unverified high-elevation dispersed site on the Canaan Loop Road in the Monongahela National Forest.  Adjacent to the North Fork of Red Run Creek.  --AWH,federal,-11.035080000000006,cooler,3399
Canaan Loop Road dispersed campsite #12,"39.0570,-79.5182",creek,WV,https://www.fs.usda.gov/r09/monongahela/recreation/canaan-mountain-backcountry,Beautiful high-elevation site at the confluence of two creeks along the Canaan Loop Road in the Monongahela National Forest.  --AWH,federal,-10.635840000000004,cooler,3290
Bluestone State Park,"37.6170,-80.9205",lake,WV,,Campground on Bluestone Lake (USACE reservoir) with lakeside campsites.,state,-4.089239999999995,slightly cooler,2181
Dick Cross Wildlife Management Area,"36.6166,-78.2875",none,VA,https://tmbtent.com/virginia-free-dispersed-camping/,Small WMA in the Virginia Piedmont; dispersed camping is not documented as waterfront.,state,4.591080000000003,slightly warmer,252
Rapidan WMA,"38.4212,-78.4062",none,VA,https://tmbtent.com/virginia-free-dispersed-camping/,"Rapidan WMA permit required
WMA dispersed camping area; sites are parking-area based and not confirmed to be directly on the Rapidan River.",state,-3.524399999999998,similar,1617
White Oak Mountain Wildlife Management Area,"36.7900,-79.3297",none,VA,https://tmbtent.com/virginia-free-dispersed-camping/,Mountain/upland WMA; no waterfront features noted.,state,2.1846600000000023,similar,839
Amelia Wildlife Management Area,"37.4674,-77.9110",lake,VA,https://dwr.virginia.gov/wma/amelia/,"One of the best dispersed camping areas in VA according to tmbtent.com
Multiple parking areas, including one on the lake.  --AWH",state,2.790540000000004,similar,328
Walnut Flats Campground,"37.1991,-80.8851",none,VA,"https://tmbtent.com/virginia-free-dispersed-camping/
https://www.fs.usda.gov/r08/gwj/recreation/walnut-flats-campground",Small no-fee first-come-first-served USFS campground near the Appalachian Trail.  --AWH,federal,-4.144320000000002,slightly cooler,2408
Scotchtown Draft dispersed camping area,"38.1539,-79.5968",river,VA,https://tmbtent.com/virginia-free-dispersed-camping/,"Sites on the north side of the road have great views, and the site closest to the river has water access.  Indian Draft Road is paved, but quite steep.  Scotchtown Draft Road is a dirt road that’s less steep, but can get pretty rugged in places.  --AWH",federal,-2.78586,similar,1545
Oronoco Campground,"37.7479,-79.2648",none,VA,https://tmbtent.com/virginia-free-dispersed-camping/,Dispersed camping area in the Blue Ridge Mountains; no waterfront features documented.,federal,-2.675160000000002,similar,1719
Chickahominy Riverfront Park,"37.2652,-76.8722",river,VA,https://www.jamescitycountyva.gov/4149/Chickahominy-Riverfront-Park,"One of VA's best RV campgrounds according to campingprepper.com
Multiple riverfront sites (106-118 suitable for campervans).  --AWH",local,4.2426,slightly warmer,22
Black Mountain Campground,"35.7516,-82.2209",creek,NC,"https://www.fs.usda.gov/r08/northcarolina/recreation/black-mountain-campground
https://www.recreation.gov/camping/campgrounds/273780
https://campingprepper.com/asheville-nc-campgrounds/","USFS campground in Pisgah National Forest; RV sites 1, 7, and 17 are directly along the South Toe River.  --AWH",federal,-3.761820000000005,similar,3031
Mount Pisgah Campground,"35.4029,-82.7568",none,NC,"https://www.recreation.gov/camping/campgrounds/234182
https://campingprepper.com/asheville-nc-campgrounds/",High-elevation Blue Ridge Parkway campground with no water bodies adjacent.,federal,-9.966960000000004,cooler,4947
Powhatan State Park,"37.6865,-77.9247",none,VA,"https://www.dcr.virginia.gov/state-parks/powhatan
https://www.reservevaparks.com/Web/#!park/26",The park is on the James River but the campground sites are on a bluff/wooded area above the river; sites are not directly on the water.,state,2.712059999999996,similar,239
Cross Rip Campground,"37.5486,-76.3100",bay,VA,https://crossripcamp.com/,Private campground right on the bay with a few waterfront sites.  Slightly pricey but not outrageous given facilities and location.  --AWH,private,3.75588,similar,16
Lake Powhatan Recreation Area & Campground,"35.4877,-82.6297",none,NC,https://campingprepper.com/asheville-nc-campgrounds/,"There is a small lake nearby, but the campground is not on the lake.",federal,-0.8414999999999933,similar,2345
Wilson's Riverfront RV Park,"35.5660,-82.5874",river,NC,https://wilsonsrvpark.com/,Several $40 primitive RV sites right on the French Broad River.  Good Sam discount available.  --AWH,private,0.32795999999999587,similar,1978
Hog Island Wildlife Management Area - Carlisle Tract,"37.1445,-76.6848",bay,VA,,Low-lying WMA peninsula on the James River estuary near the Chesapeake Bay with multiple camping areas along a dedicated fishing beach.  --AWH,state,4.471559999999999,slightly warmer,19
Chickahominy Wildlife Management Area,"37.3176,-76.9127",river,VA,,WMA along the Chickahominy River with one riverfront camping/parking spot just north of the Eagle Bottom area.  --AWH,state,4.042980000000002,slightly warmer,52
Hardware River Wildlife Management Area,"37.7568,-78.4286",none,VA,,"WMA near the Hardware River, but camping is parking-area based and not confirmed to be directly on the water.",state,2.2345200000000034,similar,337
Featherfin Wildlife Management Area,"37.3741,-78.5803",none,VA,,"WMA near the Briery Creek watershed, but camping is not confirmed to be directly lakeside.",state,2.6776800000000027,similar,406
Twin Lakes State Park,"37.1756,-78.2787",none,VA,"https://www.dcr.virginia.gov/state-parks/twin-lakes
https://www.reservevaparks.com/Web/#!park/34",Park is located on a lake.  Campground is not lakefront.,state,2.660579999999995,similar,511
Bear Creek Lake State Park,"37.5320,-78.2732",lake,VA,"https://www.dcr.virginia.gov/state-parks/bear-creek-lake
https://www.reservevaparks.com/Web/#!park/1","There is one waterfront RV site (A18).
In 2026, campground opens 3/6 and will be closed 5/4-17, 6/21-7/1, and 8/10-23.  --AWH",state,2.6742600000000065,similar,328
Holliday Lake State Park,"37.3980,-78.6414",none,VA,"https://www.dcr.virginia.gov/state-parks/holliday-lake
https://www.reservevaparks.com/Web/#!park/13",Park is located on a lake.  Campground is not lakefront.,state,2.131559999999994,similar,547
Briery Creek Wildlife Management Area,"37.1967,-78.4373",lake,VA,https://dwr.virginia.gov/wma/briery-creek/,"WMA centered on the 845-acre Briery Creek Lake with multiple camping/parking areas at the lakeshore, two of which are within the no-hunting safety area.  --AWH",state,2.6577,similar,501
Bath County Recreational Campground,"38.1855,-79.8263",none,VA,,County campground in the mountains of Bath County; no waterfront features documented.,local,-4.679639999999996,slightly cooler,2060
Bandits Roost Campground,"36.1252,-81.2428",lake,NC,"https://www.saw.usace.army.mil/Locations/District-Lakes-and-Dams/W-Kerr-Scott/Recreation/Recreation-Areas/
https://www.recreation.gov/camping/campgrounds/233421",USACE campground on W. Kerr Scott Reservoir with lakefront sites on the shoreline.  --AWH,federal,2.632500000000001,similar,1049
Fairy Stone State Park,"36.7884,-80.0947",none,VA,,State Park on Fairy Stone Lake.  Cabins are waterfront but campground is not.  --AWH,state,0.8888399999999953,similar,1204
Falls Lake State Recreation Area,"36.0230,-78.6994",lake,NC,https://northcarolinastateparks.reserveamerica.com/camping/falls-lake-state-recreation-area/r/campgroundDetails.do?contractCode=NC&parkId=552902,Wooded campground with multiple lakefront RV sites.  --AWH,state,5.273459999999995,slightly warmer,360
Chestnut Ridge Regional Park,"39.6803,-79.7806",none,WV,,"campingprepper.com/best-west-virginia-rv-campgrounds
Ridge-top park near Morgantown; no significant water bodies at the campground.",local,-7.920180000000004,slightly cooler,2214
Pipestem Campground,"37.5187,-80.9820",none,WV,,"campingprepper.com/best-west-virginia-rv-campgrounds
Campground on a mountain plateau above the Bluestone River gorge; far above the river.",state,-5.994900000000005,slightly cooler,2765
Lake Sherwood Recreation Area,"38.0063,-80.0109",lake,VA,https://www.recreation.gov/camping/campgrounds/232009,One of WV's best campgrounds with several campsites are right on the lake.  --AWH,federal,-6.767280000000005,slightly cooler,2736
Holly River State Park,"38.6653,-80.3545",creek,WV,,"campingprepper.com/best-west-virginia-rv-campgrounds
Campground in a narrow valley along the Left Fork of Holly River with some sites along the creek.",state,-4.3966800000000035,slightly cooler,1738
Summersville Lake Retreat & Lighthouse,"38.1995,-80.8666",none,WV,,Voted best campground in WV by campingprepper.com.  Primitive campsites seem to be available at a reasonable price for small RVs.  No lakefront sites.,private,-4.622940000000001,slightly cooler,2037
Bulltown Campground,"38.7935,-80.5614",lake,WV,https://www.recreation.gov/camping/campgrounds/233443,"One of WV's best campgrounds according to campingprepper.com
Multiple lakefront campsites",federal,-1.5737400000000026,similar,882
Baker's Run Campground,"38.6348,-80.5746",river,WV,,"campingprepper.com/best-west-virginia-rv-campgrounds
USACE campground on the Elk River/Burnsville Lake area with waterfront sites.",federal,-1.4869799999999969,similar,938
Big Bend Campground,"38.8897,-79.2388",river,WV,,"campingprepper.com/best-west-virginia-rv-campgrounds
USFS campground along the South Branch of the Potomac River in the Smoke Hole canyon with sites adjacent to the water.",federal,-3.0455999999999954,similar,1246
Spruill Conservation Farm (HipCamp),"35.9416,-76.5756",bay,NC,,Beautiful soundfront views on the Swan Bay area of Albemarle Sound.  --AWH,private,6.683579999999998,slightly warmer,6
1560 Fire Trail Rd,"38.9807,-78.0037",none,VA,,"County Line Parking Area, Thompson WMA, permit required",state,-5.631299999999998,slightly cooler,1925
1690 Fire Trail Rd,"38.9854,-77.9996",none,VA,,"Appalachian Trail Parking Area, Thompson WMA, permit required",state,-5.312159999999997,slightly cooler,1834
1868 Fire Trail Rd,"38.9918,-77.9946",none,VA,,"Orchard Parking Area, Thompson WMA, permit required",state,-5.019479999999995,slightly cooler,1748
300 Fire Trail Rd,"38.9676,-78.0183",none,VA,,"Ridge Parking Area, Thompson WMA, permit required",state,-6.028919999999995,slightly cooler,2044
630 Fire Trail Rd,"38.9716,-78.0176",none,VA,,"Rock Spring Parking Area, Thompson WMA, permit required",state,-6.059520000000004,slightly cooler,2050
Cherry Springs State Park Rustic Campground,"41.6633,-77.8193",none,PA,,"Cherry Springs State Park is nearly as remote and wild today as it was two centuries ago. Its dark skies make it a haven for astronomers. Due to its exceptionally dark skies, Cherry Springs State Park is one of the best places on the eastern seaboard for stargazing and the science of astronomy",state,-11.828879999999998,cooler,2309
Watchman Campground,"37.1964,-112.9876",none,UT,,"This Zion National Park campground nestled at the base of the iconic Watchman Peak offers dramatic views of red sandstone cliffs. The towering formations create a breathtaking backdrop, especially at sunrise or sunset.",federal,-9.556559999999996,cooler,3927
North Rim Campground,"36.2088,-112.0602",none,AZ,,"Perched on the quieter, less-visited North Rim, this campground provides jaw-dropping vistas of the Grand Canyon’s vast expanse. The elevation and remoteness enhance the sweeping views of the canyon’s layered cliffs.",federal,-23.503679999999992,much cooler,8337
Silver Bell,"39.1428,-106.8953",none,CO,,"Located near Aspen, this campground frames the iconic Maroon Bells—twin peaks rising above Maroon Lake. The rugged Elk Mountains and golden aspens in fall make it a postcard-worthy spot.  Not lakefront.",federal,-29.42838,much cooler,8517
Kirk Creek Campground,"35.9900,-121.4957",coastal dunes,CA,"https://www.recreation.gov/camping/campgrounds/233116
https://www.campsitephotos.com/campground/ca/kirk-creek/","Perched high above the Pacific Ocean along the rugged Big Sur coast, this spot offers RV sites with panoramic views of waves crashing against the cliffs below.  --AWH",federal,5.754059999999996,slightly warmer,242
Many Glacier Campground,"48.7967,-113.6773",creek,MT,,Stunning views of Glacier's iconic mountains.  Several campsites are right on the creek.  A lake is nearby.,federal,-34.00560000000001,much cooler,4928
