name,location,waterfront,state,website,note,ownership,delta_temp,climate,elevation_feet
Tuolumne Meadows Campground,"37.8712,-119.3577",river,CA,,"High in the Sierra Nevada, this Yosemite campground features sweeping views of granite domes, meadows, and waterfalls.  Site A028 is the only RV site that backs up directly to the river.",federal,-27.619200000000003,much cooler,8651
Kalaloch Campground,"47.6130,-124.3761",coastal dunes,WA,,"Olympic National Park campground overlooking the Pacific Ocean, this campground provides dramatic coastal views from bluff-top sites.  --AWH",federal,-14.47704,much cooler,49
Kayenta Campground,"38.4860,-109.7404",none,UT,,"Just outside Arches and Canyonlands, this campground overlooks the Colorado River’s dramatic 2,000-foot cliffs. The sunrise casts a fiery glow over the desert landscape, rivaling the Grand Canyon in grandeur.
Campground on a mesa top far above the Colorado River; not at river level.",federal,-19.178639999999994,much cooler,5974
Juniper Springs Campground,"29.1839,-81.7120",none,FL,,Ocala National Forest campground adjacent to the crystal-clear Juniper Springs Run.  Campsites are not waterfront.,federal,18.613439999999997,much warmer,72
Paynetown Campground,"39.0773,-86.4419",lake,IN,https://indianastateparks.reserveamerica.com/,"Situated on Indiana's largest lake, this campground offers several lakefront campsites.",state,-0.8443800000000017,similar,534
Houchin Ferry Campground,"37.2015,-86.2377",river,KY,,NPS campground in Mammoth Cave National Park with waterfront sites along the Green River.,federal,2.754359999999995,similar,472
Savanna Portage State Park Campground,"46.8264,-93.1515",lake,MN,,"East of the Mississippi in northern Minnesota, this campground overlooks shimmering lakes surrounded by dense woods. The peaceful water views and vibrant autumn colors stand out.
Campground with lakefront sites on Savanna Lake.",state,-17.565659999999998,much cooler,1312
Davidson River Campground,"35.2812,-82.7226",none,NC,,"USFS campground in Pisgah National Forest.  The Davidson river runs alongside the campground, but sites are set back behind vegetation and a trail.",federal,0.16200000000000375,similar,2168
Cranberry Lake Campground,"44.2055,-74.8312",lake,NY,,Most campsites are right on the lake.  --AWH,state,-13.90104,cooler,1607
Elkmont Campground,"35.6577,-83.5835",river,TN,,Great Smoky Mountains campground with some RV sites directly along the Little River.,federal,-0.8432999999999963,similar,2260
Orchard Beach State Park,"44.2817,-86.3153",coastal dunes,MI,,"Campground is on a tall, steep bluff high above Lake Michigan; Some RV sites are right on the edge of the bluff.  The lake is visible from some sites, but the beach is far below and is no longer accessible due to erosion.  --AWH",state,-10.668600000000001,cooler,662
Apgar Campground,"48.5263,-113.9820",none,MT,,Glacier National Park campground near the foot of Lake McDonald; Campsites are not directly on the lake.  --AWH,federal,-27.352979999999995,much cooler,3198
Hither Hills State Park Campground,"41.0085,-72.0102",coastal dunes,NY,,"Campsites are close to the beach, but view and access are blocked by dunes.  --AWH",state,-2.565539999999996,similar,42
Cape Lookout State Park Campground,"45.3660,-123.9687",coastal dunes,OR,,"Campsites are close to the beach, but view and access are blocked by dunes.  --AWH",state,-10.38564,cooler,36
Devil's Lake State Park,"43.4284,-89.7314",none,WI,,"There is a lake in the park, but the campground is not lakefront.  --AWH",state,-10.290960000000007,cooler,987
Deception Pass Camp,"48.3994,-122.6593",none,WA,,"Campground loops are set back in the forest, not directly on Cranberry Lake's shoreline.",state,-16.068060000000003,much cooler,98
Jumbo Rocks Campground,"33.9917,-116.0628",none,CA,,Desert campground in Joshua Tree National Park with no water bodies.,federal,-5.355900000000002,slightly cooler,4367
Sage Creek Campground,"43.8941,-102.4144",none,SD,,Primitive grassland campground in the Badlands; Sage Creek is intermittent and often dry.,federal,-16.663320000000002,much cooler,2539
Molly Stark State Park,"42.8525,-72.8149",none,VT,,Mountain-top park on Mount Olga with no significant water bodies.,state,-12.460139999999999,cooler,1886
Lake St. Catherine State Park,"43.4816,-73.2049",lake,VT,,A small number of campsites are either lakefront or creekfront.  Trees may obstruct the view.,state,-8.725320000000002,slightly cooler,521
Emerald Lake State Park,"43.2808,-73.0049",none,VT,,"There is a lake in the park, but the campground is not lakefront.",state,-9.27648,cooler,777
Coolidge State Park,"43.5517,-72.6975",none,VT,,Forested mountainside park with no water bodies at the campground.,state,-13.016699999999995,cooler,1689
Jamaica State Park,"43.1057,-72.7733",river,VT,,Campground along the West River with riverside campsites directly on the riverbank.,state,-8.610299999999997,slightly cooler,679
Pine Grove Furnace State Park,"40.0321,-77.2928",none,PA,,Campground is in a wooded area set back from Laurel and Fuller Lakes; campers walk to the lakes.,state,-3.75642,similar,869
Weiser State Forest (Halderman Tract) Campsite H4 Tract),"40.5095,-76.7498",none,PA,,Dispersed state forest campsite; no waterfront features documented.,state,-6.7451400000000055,slightly cooler,1466
Weiser State Forest Greenland Tract,"40.5674,-76.6026",none,PA,,Dispersed state forest campsite; no waterfront features documented.,state,-7.200359999999999,slightly cooler,1565
Locust Lake State Park Campground,"40.7850,-76.1195",none,PA,,Some campsites are close to the lake but not officially lakefront.,state,-6.480539999999993,slightly cooler,1253
Frances Slocum State Park,"41.3407,-75.8926",none,PA,,The park has Frances Slocum Lake but the campground is set back from the lake in wooded hills.,state,-7.071299999999996,slightly cooler,1138
Lackawanna State Park,"41.5627,-75.7067",none,PA,,The park has Lackawanna Lake but the campground area is in the hills above the lake.,state,-6.8858999999999995,slightly cooler,974
Salt Springs State Park,"41.9118,-75.8652",none,PA,,"The park features Fall Brook with waterfalls but the camping area is in the woods, not directly on the brook.",state,-8.40348,slightly cooler,1223
Lake George Battleground State Campground,"43.4148,-73.7121",none,NY,,Wooded campground right in town.  Walk to lake or downtown area.  Campsites are not lakefront.,state,-8.172179999999999,slightly cooler,400
Robert Moses State Park - Thousand Islands,"45.0013,-74.8507",river,NY,https://newyorkstateparks.reserveamerica.com/camping/robert-moses-state-park/r/campgroundDetails.do?contractCode=NY&parkId=427,"Multiple campsites are right on the water, some on the north island and some on the south island.  --AWH",state,-10.489680000000002,cooler,249
Coles Creek State Park,"44.8936,-75.1381",river,NY,,,state,-10.307519999999998,cooler,252
Keewaydin State Park,"44.3238,-75.9349",river,NY,,,state,-9.352079999999999,cooler,272
Kring Point State Park,"44.3762,-75.8584",river,NY,,,state,-9.376199999999995,cooler,252
Jacques Cartier State Park,"44.5614,-75.6846",river,NY,,,state,-9.768059999999998,cooler,269
Dewolf Point State Park,"44.3323,-75.9908",none,NY,,"Park is on a lake, but all of the campsites are set back into the woods.  Max 20ft length for RVs.  --AWH",state,-9.308879999999993,cooler,255
Wellesley Island State Campground,"44.3292,-76.0366",river,NY,,numerous riverfront campsites with direct access to the water.  --AWH,state,-9.3384,cooler,265
Grass Point State Park,"44.2798,-75.9990",riverview,NY,,"Many sites adjacent to the river, but most are separated from the river by either the marina or the driveway.  --AWH",state,-9.226080000000003,cooler,259
Southwick Beach State Park,"43.7668,-76.2090",coastal dunes,NY,,"Some sites are lakefront but the view may be blocked by dunes, and the beach can only be accessed via marked trails.  --AWH",state,-8.337780000000006,slightly cooler,269
Fair Haven Beach State Park,"43.3303,-76.6966",lakeview,NY,,"There are several sites up on the bluff, adjacent to the lake, but they are separated from the lake by the driveway and vegetation may block the view.  --AWH",state,-7.680780000000002,slightly cooler,305
Hamlin State Park,"43.3591,-77.9500",coastal woods,NY,,Campground is set back from the Lake Ontario shore in wooded loops.  --AWH,state,-7.685819999999997,slightly cooler,292
Four Mile Creek State Park,"43.2736,-78.9960",lake,NY,https://www.campsitephotos.com/campground/ny/four-mile-creek-state-park/,Several sites are right on the water with a nice view of the lake.  --AWH,state,-7.461720000000004,slightly cooler,272
Evangola State Park Campground,"42.6021,-79.1178",lakeview,NY,https://newyorkstateparks.reserveamerica.com/campgroundDetails.do?contractCode=NY&parkId=302#sr_a,"The park is on Lake Erie but the campground is set back in wooded loops.  35, 37, and 41 may have a better view of the lake than others.  --AWH",state,-7.35282,slightly cooler,580
Macomb Reservation State Park,"44.6157,-73.6078",lake,NY,,Multiple waterfront sites mentioned in reviews.  Photos are hard to find.  --AWH,state,-11.375099999999994,cooler,692
Bowman Lake State Park,"42.5169,-75.6784",none,NY,,Lake is nearby but not within campground.  --AWH,state,-11.35296,cooler,1745
Selkirk Shores State Park,"43.5531,-76.2056",lakeview,NY,,"There are several sites on the bluff overlooking the lake, but the view may be partially blocked by vegetation.  --AWH",state,-8.11692,slightly cooler,314
Oquaga Creek State Park,"42.1879,-75.4188",none,NY,,"Campground is in a wooded area on a ridge, not along the creek.",state,-10.573559999999997,cooler,1692
Gilbert Lake State Park,"42.5901,-75.1341",none,NY,,Lake is nearby but not within campground.,state,-11.192219999999999,cooler,1663
Glimmerglass State Park,"42.7867,-74.8621",none,NY,,"Park is on the shore of Otsego Lake, but campground is back in the woods.  --AWH",state,-10.060200000000005,cooler,1246
Delta Lake State Park,"43.2904,-75.4167",lake,NY,,Multiple lakefront campsites  --AWH,state,-8.498159999999997,slightly cooler,554
Chenango Valley State Park,"42.2156,-75.8342",none,NY,,"There is a lake in the park, but the campground is set back in the wooded area away from the lake.  --AWH",state,-7.897320000000004,slightly cooler,928
Green Lakes State Park,"43.0582,-75.9715",none,NY,,Lakes are nearby but not within campground.,state,-7.857899999999998,slightly cooler,492
Lake Erie State Park,"42.4215,-79.4298",lake,NY,,"There are a small number of lakefront campsites, all of which are up on a bluff overlooking the lake.",state,-7.226640000000003,slightly cooler,636
Verona Beach State Park,"43.1767,-75.7293",lake,NY,,Campground on the shore of Oneida Lake with sites near the lakeshore.,state,-7.755299999999995,slightly cooler,403
Oneida Shores County Park,"43.2275,-76.1124",lake,NY,,County park directly on Oneida Lake's southern shore with lakefront campsites.,local,-7.846739999999999,slightly cooler,403
Cedar Point State Park,"44.2027,-76.1927",riverview,NY,,There is one 20ft riverfront site.  The rest are separated from the river by the driveway.,state,-9.180900000000001,cooler,285
Burnham Point State Park,"44.1628,-76.2631",riverview,NY,,"All of the riverfront campsites are tent-only, but there are several RV sites that are separated from the river only by the driveway and the tent sites.  --AWH",state,-9.027179999999994,cooler,262
Long Point State Park - Thousand Islands,"44.0266,-76.2202",bay,NY,,,state,-8.770320000000003,slightly cooler,259
Westcott Beach State Park,"43.9001,-76.1227",lakeview,NY,,"No sites are right on the lake, but several sites in the lower campground are adjacent to the lake, separated only by the driveway.  --AWH",state,-8.647920000000004,slightly cooler,288
Lakeside State Park,"43.3668,-78.2361",coastal woods,NY,,"Despite the name, the campground is set back from Lake Ontario in wooded loops.  --AWH",state,-7.676279999999997,slightly cooler,285
Golden Hill State Park,"43.3725,-78.4880",lake,NY,,Several sites are right on the lake with a spectacular lake view.  --AWH,state,-7.628040000000003,slightly cooler,269
Lake Harris,"43.9725,-74.1271",lake,NY,,Multiple lakefront campsites,state,-13.481639999999993,cooler,1607
Wilmington Notch Campground,"44.3501,-73.8608",none,NY,,Close to Lake Placid in a wooded roadside setting along the Ausable River; campsites are not waterfront.  --AWH,state,-13.354019999999995,cooler,1381
Meadowbrook Campground,"44.2981,-74.0750",none,NY,,Close to Lake Placid in a wooded roadside setting  --AWH,state,-14.173019999999996,much cooler,1637
Grand Isle State Park,"44.6872,-73.2928",lake,NY,,Campground on Grand Isle with sites directly along the Lake Champlain shoreline.,state,-9.526499999999995,cooler,137
Scaroon Manor Campground,"43.7694,-73.7891",lake,NY,,DEC campground on the shore of Schroon Lake known for its lakefront campsites and beach.,state,-10.588859999999995,cooler,898
Putnam Pond Campground,"43.8403,-73.5670",pond,NY,,"Possible issue with mosquitos.  Marsh nearby.
DEC campground with sites directly along the shore of Putnam Pond.",state,-12.167279999999998,cooler,1305
Paradox Pond Campground,"43.8818,-73.6758",none,NY,,Near the Paradox Lake area but sites are not confirmed to be directly on the water.,state,-10.990079999999997,cooler,954
Lake Eaton Campground,"43.9867,-74.4566",lake,NY,,"Many lakefront campsites.  Reviews suggest that sites are small, road is bad, and maintenance is poor.  --AWH",state,-14.185799999999997,much cooler,1797
Cumberland Bay State Park,"44.7236,-73.4267",lake,NY,,A few waterfront campsites  --AWH,state,-9.533519999999996,cooler,121
Nicks Lake Campground,"43.6744,-74.9869",lake,NY,,Multiple waterfront campsites  --AWH,state,-13.401359999999997,cooler,1735
Moffitt Beach State Campground,"43.4934,-74.3982",lake,NY,,Multiple waterfront campsites  --AWH,state,-13.192560000000002,cooler,1768
Limekiln Lake State Campground,"43.7180,-74.7957",lake,NY,,Multiple waterfront campsites  --AWH,state,-14.193540000000006,much cooler,1935
Lewey Lake Campsite,"43.6474,-74.3888",lake,NY,,Multiple waterfront campsites  --AWH,state,-13.083659999999995,cooler,1660
Lake Durant State Campground,"43.8385,-74.3842",lake,NY,,Multiple waterfront campsites  --AWH,state,-14.000940000000007,much cooler,1820
Golden Beach Campground,"43.8162,-74.5954",lake,NY,,Multiple waterfront campsites  --AWH,state,-13.925700000000003,cooler,1811
Eighth Lake Campground,"43.7656,-74.7085",lake,NY,,Multiple waterfront campsites  --AWH,state,-13.893119999999998,cooler,1827
Meacham Lake Campground,"44.5779,-74.2860",lake,NY,,Multiple waterfront campsites  --AWH,state,-14.372459999999998,much cooler,1551
Fish Creek Pond Campground,"44.3040,-74.3590",lake,NY,,"Multiple waterfront campsites, most of which are small and close together  --AWH",state,-14.066640000000003,much cooler,1604
New Discovery State Park,"44.3221,-72.2891",none,VT,,Campground is in a wooded hillside area in Groton State Forest; Osmore Pond is accessed via a trail from the campground.,state,-14.672519999999999,much cooler,1765
Little River State Park,"44.3898,-72.7673",none,VT,,Campground is on a wooded hillside above Waterbury Reservoir; sites are set back in the forest.,state,-11.284380000000002,cooler,780
Smugglers' Notch State Park Campground,"44.5209,-72.7741",none,VT,,Mountain notch campground between Mt. Mansfield and Sterling Peak with no significant water body adjacent.,state,-14.024159999999995,much cooler,1483
Elmore State Park,"44.5445,-72.5278",lake,VT,,Campground on Lake Elmore with sites near the lake shore and beach area.,state,-13.025339999999998,cooler,1191
Crown Point Campground,"44.0265,-73.4221",lakeview,NY,,DEC campground on a point on Lake Champlain.  A few sites have a lake view.  --AWH,state,-8.325539999999997,slightly cooler,134
Northampton Beach Campground,"43.1891,-74.1754",lake,NY,,DEC campground on Great Sacandaga Lake known for its sandy beach and lakefront campsites.,state,-9.181620000000006,cooler,797
Buck Pond Campground,"44.5047,-74.1135",lake,NY,,A few of the campsites are on the lake  --AWH,state,-14.6268,much cooler,1660
Rollins Pond Campground,"44.3101,-74.4083",lake,NY,,"Multiple waterfront campsites, most of which are fairly large and private.  --AWH",state,-14.007419999999998,much cooler,1584
West Thompson Lake Campground,"41.9563,-71.8987",none,CT,,"There is a lake nearby, but the campground is not lakefront.",federal,-5.663879999999997,slightly cooler,433
Fresh Gardens (Hipcamp),"25.4747,-80.5068",none,FL,,Hipcamp property in the Florida Homestead agricultural area; no significant water body adjacent.,private,25.442100000000003,hot,29
Gate to the Keys (Hipcamp),"25.4460,-80.5341",none,FL,,Hipcamp in the agricultural area west of Homestead; not on a significant waterfront.,private,25.517159999999997,hot,22
John Pennekamp Camp Area,"25.1226,-80.4080",coastal woods,FL,,Campground sites are in a wooded hammock area set back from the water; the park is famous for its reef and water access but the campground itself is inland.,state,26.064180000000004,hot,32
Bahia Honda State Park RV Campground,"24.6582,-81.2768",coastal dunes,FL,https://www.floridastateparks.org/BahiaHonda,Campground on a narrow key in the Florida Keys with some sites right on the shore.  --AWH,state,26.982,hot,9
Faver-Dykes State Park Campground,"29.6689,-81.2522",none,FL,,Campground is in a wooded upland area set back from Pellicer Creek; the creek is accessed via trails.,state,17.82234,much warmer,49
Jonathan Dickinson State Park River Campground,"26.9913,-80.1420",none,FL,"https://www.floridastateparks.org/parks-and-trails/jonathan-dickinson-state-park
https://www.campsitephotos.com/campground/fl/jonathan-dickinson-state-park/","Park on the Loxahatchee River with two campgrounds, a nature boardwalk, observation tower, and kayaking options.  Campgrounds are not waterfront.  --AWH",state,22.700520000000004,hot,32
Tomoka State Park Campground,"29.3390,-81.0818",none,FL,https://www.floridastateparks.org/Tomoka,Campground on a peninsula between the Tomoka and Halifax Rivers; campground is not waterfront.  --AWH,state,18.427860000000003,much warmer,45
Lake Michigan at St. Ignace,"45.9856,-84.9720",coastal woods,MI,"https://www.recreation.gov/camping/campgrounds/234081
https://www.campsitephotos.com/campground/mi/lake-michigan-at-st-ignace/","Campsites are in the woods, very close to Lake Michigan.  --AWH",federal,-13.571819999999995,cooler,616
Brevort Lake Campground,"46.0073,-84.9737",lake,MI,"https://www.recreation.gov/camping/campgrounds/234080
https://www.campsitephotos.com/campground/mi/brevoort-lake/","Multiple campsites right on Brevoort Lake, about a mile from Lake Michigan.  --AWH",state,-13.821480000000001,cooler,675
D. H. Day Campground,"44.8967,-86.0202",coastal woods,MI,,Sites are in a wooded area set back from Lake Michigan with a forested buffer; campers walk to the beach.  --AWH,federal,-11.576700000000004,cooler,606
Davis Bayou Campground,"30.3974,-88.7962",coastal woods,MS,,"Gulf Islands National Seashore campground in a wooded area among live oaks, a short walk from the gulf inlet.  --AWH",federal,16.56954,much warmer,32
Fort Pickens Campground,"30.3235,-87.2745",coastal dunes,FL,"https://www.recreation.gov/camping/campgrounds/234704
https://www.campsitephotos.com/campground/fl/fort-pickens-recreation-area/",Campground on a narrow barrier island with sites behind dunes and direct access to the Gulf of Mexico beach and Pensacola Bay.  --AWH,federal,16.73766,much warmer,22
Frisco Campground,"35.2369,-75.6034",coastal dunes,NC,,Campground is oceanfront but view and access may be blocked by dunes.  --AWH,federal,7.928640000000003,slightly warmer,13
Salt Springs Recreation Area,"29.3579,-81.7336",none,FL,,Ocala National Forest campground in a wooded area near Salt Springs Run; not directly on Lake George.,federal,18.253439999999998,much warmer,85
St. Lucie South Campground,"27.1115,-80.2841",river,FL,"https://www.recreation.gov/camping/campgrounds/233638
https://www.campsitephotos.com/campground/fl/st-lucie-south/",USACE campground located at one of the locks on the St. Lucie river.  Three of the nine RV sites are waterfront.  --AWH,federal,22.53096,hot,19
Ortona South Lock Campground,"26.7879,-81.3073",river,FL,"https://www.recreation.gov/camping/campgrounds/233570
https://www.campsitephotos.com/campground/fl/ortona-south/",USACE campground directly on the Caloosahatchee River at the Ortona Lock.  Several sites are right on the river.  --AWH,federal,23.04324,hot,39
W.P. Franklin North Campground,"26.7236,-81.6934",river,FL,https://www.recreation.gov/camping/campgrounds/233661,USACE campground directly on the Caloosahatchee River at the W. P. Franklin lock.  Several sites are right on the river.  --AWH,federal,23.22918,hot,19
Mitchell Landing Campground,"25.7544,-80.9266",none,FL,https://www.recreation.gov/camping/campgrounds/10214609,Small primitive roadside campground in Big Cypress National Preserve.  --AWH,federal,24.97374,hot,19
Burns Lake Campground (Big Cypress National Preserve),"25.8935,-81.2302",lake,FL,"https://www.recreation.gov/camping/campgrounds/246890
https://www.campsitephotos.com/campground/fl/burns-lake/",14 spacious campsites surrounding a lake in Big Cypress National Preserve.  --AWH,federal,24.77016,hot,6
Monument Lake Campground,"25.8689,-81.1144",lake,FL,"https://www.recreation.gov/camping/campgrounds/246894
https://www.campsitephotos.com/campground/fl/monument-lake/",38 spacious campsites (28 RV and 10 tent only) situated around the lake in Big Cypress National Preserve.  --AWH,federal,24.779339999999998,hot,16
Midway Campground,"25.8509,-80.9895",lake,FL,"https://www.recreation.gov/camping/campgrounds/246892
https://www.campsitephotos.com/campground/fl/midway/",37 single-family campsites that surround a small lake in Big Cypress National Preserve.  --AWH,federal,24.800040000000003,hot,19
Collier-Seminole State Park,"25.9917,-81.5917",none,FL,"https://www.floridastateparks.org/parks-and-trails/collier-seminole-state-park
https://www.campsitephotos.com/campground/fl/collier-seminole-state-park/",120 single-family campsites and is located within a large mangrove swamp in the Florida Everglades.  --AWH,state,24.476399999999998,hot,39
Big Lagoon State Park Campground,"30.3144,-87.4114",coastal woods,FL,"https://www.floridastateparks.org/BigLagoon
https://www.campsitephotos.com/campground/fl/big-lagoon-state-park/",75 campsites in a sandy wooded setting within walking distance of Big Lagoon Bay and a mile from the gulf coast.  --AWH,state,16.73064,much warmer,29
Henderson Beach State Park Campers Beach,"30.3838,-86.4370",coastal woods,FL,"https://www.floridastateparks.org/parks-and-trails/henderson-beach-state-park
https://www.campsitephotos.com/campground/fl/henderson-beach-state-park/","Campground is in the woods, a short walk to the beach on the Gulf of Mexico.  --AWH",state,16.61742,much warmer,26
St Andrew's State Park,"30.1392,-85.7412",bay,FL,,Many sites are right on St. Andrew's Bay.  Campground is a mile or so from the gulf coast.  --AWH,state,17.0928,much warmer,16
St Joseph Peninsula Campground,"29.7800,-85.4061",coastal dunes,FL,"https://www.floridastateparks.org/parks-and-trails/th-stone-memorial-st-joseph-peninsula-state-park
https://www.campsitephotos.com/campground/fl/st-joseph-peninsula-state-park/",Two campgrounds in the dunes a short walk from the Gulf of Mexico beach.  --AWH,state,17.75106,much warmer,13
Sebastian Inlet State Park Campground,"27.8587,-80.4481",river,FL,"https://www.floridastateparks.org/Sebastian-Inlet
https://www.campsitephotos.com/campground/fl/sebastian-inlet-state-park/","Campground on the Indian River Inlet adjacent to the Atlantic Ocean.  Several sites are right on the river, separated only by the driveway.  --AWH",state,21.256200000000003,hot,0
Camp Grayton Beach State Park Campground,"30.3289,-86.1551",coastal woods,FL,,Campground is set back from the Gulf beach in a wooded area close to Western Lake.  --AWH,state,16.75134,much warmer,16
Saint George Island State Campground,"29.7188,-84.7498",coastal woods,FL,https://www.floridastateparks.org/parks-and-trails/dr-julian-g-bruce-st-george-island-state-park,Campground in a sandy wooded setting a short walk to either St. George Sound or the Gulf of Mexico.  --AWH,state,17.849519999999995,much warmer,16
Squirrel Gap campsite #5,"39.0234,-78.7045",none,VA,,Numerous forest service campsites along the length of FR 344. Suitable for most vehicles.,federal,-5.626260000000004,slightly cooler,1902
Squirrel Gap campsite #4,"39.0156,-78.7042",none,VA,,Numerous forest service campsites along the length of FR 344. Suitable for most vehicles.,federal,-5.401619999999998,slightly cooler,1843
Squirrel Gap campsite #3,"39.0461,-78.6730",none,VA,,Numerous forest service campsites along the length of FR 344. Suitable for most vehicles.,federal,-4.181220000000004,slightly cooler,1486
Squirrel Gap site #2,"39.0675,-78.6449",none,WV,,Numerous forest service campsites along the length of FR 344. Suitable for most vehicles.,federal,-4.5824400000000045,slightly cooler,1588
Squirrel Gap campsite #1,"39.0668,-78.6400",none,VA,,Numerous forest service campsites along the length of FR 344. Suitable for most vehicles.,federal,-4.487580000000001,slightly cooler,1561
Flagpole rd site #3,"38.4912,-79.2133",none,WV,,campsite ~1/4 mi NE of Hone Quarry Ridge Trail,federal,-11.781899999999998,cooler,3897
Flagpole rd site #2,"38.4926,-79.2108",none,WV,,campsite ~1/2 mi NE of Hone Quarry Ridge Trail,federal,-12.135420000000005,cooler,3996
Flagpole Knob site #3,"38.5082,-79.1889",none,WV,,campsite ~1/2 mile west of Flagpole knob,federal,-12.807000000000004,cooler,4176
Flagpole Knob site #2,"38.5087,-79.1870",none,WV,,campsite just west of Flagpole Knob,federal,-13.252499999999996,cooler,4301
Flagpole Rd Campsite,"38.5009,-79.2076",none,WV,,campsite at Flagpole rd & Forest rd 85-4,federal,-12.396060000000002,cooler,4065
