name,note,state,ownership,waterfront,location,website,delta_temp,climate,elevation_feet
White Rocks Campground,White Rocks Campground is a great camp spot for those who enjoy a natural setting and dont need lots of amenities. It is set in the midst of a typical Appalachian forest and a small creek meanders through several sites.,WV,federal,creek,"37.4296,-80.4920",,-6.7003200000000005,slightly cooler,3008
Hog Camp Gap boondocking site,"Camping area adjacent to AT, a large clearing used by a lot of AT thru-hikers.  Bumpy dirt road accessible by standard sedan.
Large clearing used by AT thru-hikers at a mountain gap; no water body.",VA,federal,none,"37.7604,-79.1957",,-9.144359999999995,cooler,3527
Crabtree Falls boondocking sites,"Camping areas on rt826/Meadows lane, right off route 56.  Meadows lane is a fire road to upper falls parking lot.  Sign says 4WD but apparently many sedans are seen on the road.
Dispersed roadside sites along a fire road; near Crabtree Creek area but sites are along the road, not confirmed on the creek.",VA,federal,none,"37.8476,-79.1220",,-6.165719999999999,slightly cooler,2647
Hidden Valley WMA boondocking sites,"WMA permit required
High-elevation WMA site; not confirmed on water.",VA,state,none,"36.8504,-82.0788",,-8.29026,slightly cooler,3746
Brandywine Lake Campground,"There is a small lake nearby, but the campground is not on the lake.",WV,federal,none,"38.5971,-79.1998",,-5.1514199999999954,slightly cooler,1985
Hone Quarry Campground,Several sites are right on the creek,VA,federal,creek,"38.4623,-79.1350",,-4.674779999999998,slightly cooler,1919
Todd Lake Recreation Area Campground,"There is a small lake nearby, but the campground is not on the lake.",VA,federal,none,"38.3658,-79.2095",,-4.65318,slightly cooler,1962
North River Campground,"Some campsites are on a small creek, the North River, which eventually flows into the Shenandoah.  First come first served.",VA,federal,creek,"38.3395,-79.2072",,-4.2548400000000015,slightly cooler,1863
Babcock State Park Campground,"The park contains Glade Creek and the famous Grist Mill, but the campground is on a ridge/plateau above the creek valleys.",WV,state,none,"38.0069,-80.9484",,-5.446260000000002,slightly cooler,2365
Greenbrier State Forest Campground,"Campground in a forested mountain setting; while there are small streams, the campground is not known for waterfront sites.",WV,state,none,"37.7305,-80.3627",,-3.6500399999999984,similar,2001
Kumbrabow Crossing,Private campground; the name suggests a river crossing point but does not confirm that campsites are directly on the water.,WV,private,none,"38.6559,-80.0713",,-9.083160000000005,cooler,3057
Riverside Campground,Private campground with 'Riverside' in the name on the Greenbrier River with sites directly along the river.,WV,private,river,"38.1114,-80.1779",,-4.639860000000006,slightly cooler,2086
Beaver Creek Campground,"Private campground named for Beaver Creek, but sites are not confirmed to be directly on the water.",WV,private,none,"38.1026,-80.0943",,-6.390720000000004,slightly cooler,2582
Wolf Gap Recreation Area,,VA,federal,none,"38.9243,-78.6890",,-6.664680000000004,slightly cooler,2244
Elizabeth Furnace Family Campground,Campground is located alongside a creek.  Some sites are directly adjacent to the creek,VA,federal,creek,"38.9242,-78.3315",,-1.469699999999998,similar,787
Shaver's Fork dispersed site,"Alongside railroad tracks.  Accessible by bumpy forest service road.
Dispersed sites in a narrow valley alongside railroad tracks and the Shavers Fork river; sites are directly adjacent to the river.",WV,federal,river,"38.6492,-79.8620",,-10.8963,cooler,3569
Trout Pond Campground,Park is located on a lake.  Campground is not lakefront.,VA,federal,none,"38.9521,-78.7325",,-5.989320000000002,slightly cooler,2040
Red Run Falls dispersed camping,Dispersed camping at a named waterfall/creek location with sites directly at the creek.,WV,federal,creek,"38.6298,-79.8821",,-11.153880000000004,cooler,3651
Mower Basin dispersed camping,High-elevation basin area in Monongahela National Forest; not confirmed to be on a water body.,WV,federal,none,"38.5705,-79.9331",,-12.638340000000003,cooler,4097
Army Camp Rd Campground,NPS campground in the New River Gorge at low elevation with sites directly along the New River.,WV,federal,river,"37.8578,-81.0994",,-0.9190799999999951,similar,1171
Dolly Sods boondocking sites #3,High-elevation dispersed sites near Dolly Sods Wilderness.  --AWH,WV,federal,none,"38.9650,-79.3447",,-12.587940000000007,cooler,3884
Abes Run dispersed camping,High-elevation dispersed creekside sites at the confluence of Abes Run and the East Fork of the Greenbrier River.  Sites on far side of the river may not be accessible when water is high.  --AWH,WV,federal,river,"38.6178,-79.6765",,-10.032480000000005,cooler,3343
Seven Mile Campground,Small attractive campground fairly high up in the Seneca State Forest.  Book online via website.  --AWH,WV,federal,none,"38.3068,-79.9223",https://wvstateparks.com/parks/seneca-state-forest/lodging/,-7.2262800000000045,slightly cooler,2713
Cranberry River sites 6-19,Dispersed waterfront sites along the Cranberry River. --AWH,WV,federal,river,"38.2955,-80.5161",,-5.544539999999994,slightly cooler,2247
Big Rock Campground,USFS campground across the road from the Cranberry River.  Sites are not waterfront. --AWH,WV,federal,river,"38.2959,-80.5240",,-5.615460000000006,slightly cooler,2267
Cranberry Campground,USFS campground across the road from the Cranberry River.  Sites are not waterfront. --AWH,WV,federal,none,"38.3255,-80.4415",,-6.815339999999996,slightly cooler,2588
Island Campground,High elevation USFS campground with mostly tent sites.  Site 13 is the only creekside site that will fit an RV. --AWH,WV,federal,creek,"38.5793,-79.7052",,-8.933580000000006,slightly cooler,3054
Grandview Sandbar Campground,"NPS campground with waterfront sites on a sandbar in the New River; no fee, first-come-first-served. --AWH",WV,federal,river,"37.8552,-81.0531",,-1.440900000000006,similar,1318
Groundhog Trail Parking Lot,This is a small gravel trailhead parking lot off of VA-219/24 (Spruce Run).  There is a sign that says 'Sugar Camp Parking'.  The nearby Groundhog Trail leads up to the Appalacian Trail which runs along the ridgetop. --AWH,VA,federal,none,"37.4241,-80.6763",,-3.6718200000000047,similar,2162
Meadow Creek dispersed camp sites,Multiple dispersed campsites along Meadow Creek near Lake Sherwood Recreation Area. --AWH,WV,federal,none,"37.9595,-80.0703",,-5.887439999999998,slightly cooler,2513
Beckys Creek Wildlife Management Area,Dispersed camping sites along Becky Creek.  Camp in designated sites only. --AWH,WV,federal,creek,"38.5907,-79.9608",,-8.532899999999996,slightly cooler,2936
Shaver's Fork Dispersed Campsites,High-elevation dispersed wooded riverfront campsites spread out along the Shavers Fork of the Cheat River. --AWH,WV,federal,river,"38.6081,-79.8811",,-11.02122,cooler,3625
Stonecoal dispersed camping,Many high-elevation dispersed wooded riverfront campsites spread out along the Shavers Fork of the Cheat River. --AWH,WV,federal,river,"38.6353,-79.8718",https://thedyrt.com/camping/west-virginia/stonecoal-dispersed-camping-area,-10.976580000000002,cooler,3599
Lower Glady Dispersed Campground,Many dispersed wooded riverfront campsites spread out along the Cheat River. --AWH,WV,federal,river,"38.9637,-79.6070",https://thedyrt.com/camping/west-virginia/lower-glady-dispersed-campground,-7.086600000000004,slightly cooler,2342
Gladwin Dispersed Camping Area,"Several dispersed wooded riverfront campsites along the Glady Fork of the Cheat River, including one site on the other side of a low water bridge.  Avoid the nearby field which is private property. --AWH",WV,federal,river,"39.0077,-79.5493",https://thedyrt.com/camping/west-virginia/gladwin-dispersed-camping,-5.913899999999999,slightly cooler,1991
Camp Run Campground,Several sites are right on the creek --AWH,WV,federal,creek,"38.7475,-79.1089",,-4.193640000000004,slightly cooler,1640
Dolly Sods bookdocking sites #2,Dolly Sods high-elevation plateau; no waterfront. --AWH,WV,federal,none,"39.0660,-79.3016",,-12.933540000000004,cooler,3930
Dolly Sods boondocking sites #1,Dolly Sods dispersed wilderness area; not on a water body. --AWH,WV,federal,none,"39.0574,-79.2847",,-9.31446,cooler,2920
Squirrel Gap Road Parking,large paved parking lot just off of US-48 --AWH,WV,federal,none,"39.0676,-78.6378",,-4.336919999999997,slightly cooler,1519
Hawk Recreation Area, --AWH,VA,federal,none,"39.1165,-78.4989",,-4.0973400000000035,slightly cooler,1427
Long Run Road Campsite #2, --AWH,VA,federal,none,"38.5813,-79.0523",,-9.253079999999997,cooler,3143
Long Run Road Campsite #1, --AWH,VA,federal,none,"38.5774,-79.0371",,-10.123559999999994,cooler,3389
Western-Facing Campsite on a spur off of Long Run Road, --AWH,VA,federal,none,"38.5950,-79.0710",,-11.114639999999998,cooler,3658
Long Run Road Campsite #3, --AWH,VA,federal,none,"38.5867,-79.0579",,-10.2339,cooler,3415
"Back Ridge Shadows, LLC",Private campground at high elevation in Pendleton County on a ridge; not waterfront. --AWH,WV,private,none,"38.6734,-79.5699",,-12.378960000000001,cooler,3973
High Country Campground,Private high-elevation mountain campground in the Mt. Rogers area; not waterfront. --AWH,VA,private,none,"36.6648,-81.6031",,-6.3415799999999996,slightly cooler,3294
Grindstone Campground,Private high-elevation mountain campground; not waterfront. --AWH,VA,private,none,"36.6883,-81.5393",,-7.939979999999996,slightly cooler,3730
Canaan Valley Resort Campground, --AWH,WV,state,none,"39.0142,-79.4568",,-10.453500000000004,cooler,3261
Gatewood Park Campground,Municipal park campground on Gatewood Reservoir with some lakefront sites. --AWH,VA,local,lake,"37.0440,-80.8715",,-3.104639999999994,similar,2194
Summit Lake Campground,"There is a lake nearby, but the campsites are not lakefront --AWH",WV,federal,none,"38.2484,-80.4448",,-9.905759999999994,cooler,3494
Grayson Highlands State Park,High-altitude campground known for meadows and wild ponies; no waterfront. --AWH,VA,state,none,"36.6286,-81.4966",,-11.167019999999999,cooler,4665
Bark Camp Recreation Area,USFS campground set back in the woods near Bark Camp Lake.  Campsites are not lakefront. --AWH,VA,federal,none,"36.8694,-82.5263",,-5.212259999999998,slightly cooler,2874
Flag Rock Recreational Area,High-elevation campground operated by City of Norton; $20/night first-come-first-served; fresh water and dump station; closed winters. --AWH,VA,local,none,"36.9122,-82.6330",https://www.nortonva.gov/467/Campground,-6.985799999999998,slightly cooler,3349
High Knob Recreation Area,USFS high-elevation campground near High Knob Lookout Tower.  Campsites are not waterfront. --AWH,VA,federal,none,"36.8876,-82.6140",,-8.029619999999998,slightly cooler,3655
Fort Frederick State Park,Multiple waterfront sites on a bluff overlooking the Potomac River.  View may be blocked by vegetation. --AWH,WV,state,river,"39.6066,-78.0100",,-1.4227200000000002,similar,429
French Creek State Park Campground,"There is a lake in the park, but the campground is not lakefront. --AWH",PA,state,none,"40.2159,-75.7838",https://pennsylvaniastateparks.reserveamerica.com/camping/french-creek-state-park/r/campgroundDetails.do?contractCode=PA&parkId=880406,-4.2978599999999965,slightly cooler,928
Crooked Creek Campground,USACE campground close to the lake but not lakefront. --AWH,PA,federal,none,"40.7092,-79.5158",,-5.431500000000005,slightly cooler,997
Christopher Run Campground,"Note that the campground's lakefront sites are on the beach, and the beach is open to anyone who is staying at the campground. --AWH",VA,private,lake,"38.0973,-77.8923",,1.8673200000000054,similar,269
Machicomoco State Park Campground,Park is located along the York river.  Campground is not waterfront. --AWH,VA,state,none,"37.3092,-76.5496",,4.093200000000006,slightly warmer,42
Newport News Park,Park is located on the city reservoir.  Some campsites appear to be waterfront. --AWH,VA,local,lake,"37.1905,-76.5481",https://nnparksandrec.org/newportnewspark/,4.22496,slightly warmer,65
Chippokes State Park,"The park borders the James River, but the campground is inland in a wooded area well away from the river. --AWH",VA,state,none,"37.1403,-76.7484",,4.1983199999999945,slightly warmer,98
Williamsburg Christian Retreat Center,Inland retreat center; not on a significant water body. --AWH,VA,private,none,"37.4248,-76.8522",,3.627720000000004,similar,114
Buffalo Park and Campground,several sites are right on the beach --AWH,VA,federal,lake,"36.6619,-78.6292",,4.1819399999999955,slightly warmer,344
Longwood Park,Multiple waterfront campsites directly on the lakeshore --AWH,VA,federal,lake,"36.5768,-78.5488",https://www.recreation.gov/camping/campgrounds/233545,4.417020000000003,slightly warmer,321
Rudds Creek Campground,COE-style campground with many sites right on the lake --AWH,VA,federal,lake,"36.6575,-78.4423",,4.283460000000002,slightly warmer,318
Goose Point Park,USACE campground on a peninsula jutting into Philpott Lake with multiple campsites directly on the lakeshore. --AWH,VA,federal,lake,"36.8045,-80.0587",,1.047060000000005,similar,1151
Salthouse Branch Park,USACE campground on Philpott Lake with campsites near the lakeshore. --AWH,VA,federal,lakeview,"36.8135,-80.0387",,1.4520600000000043,similar,1033
Horseshoe Point Park,USACE campground on a horseshoe-shaped point in Philpott Lake with sites directly on the lakeshore. --AWH,VA,federal,lake,"36.8341,-80.0723",,1.5553800000000013,similar,994
Gerald Freeman Campground,Multiple waterfront campsites along the Holly River --AWH,WV,federal,lake,"38.6705,-80.5472",https://www.recreation.gov/camping/campgrounds/233678,-1.6916399999999945,similar,977
Battle Run Campground,Campground on a peninsula in Summersville lake.  Many sites are right on the water. --AWH,WV,federal,lake,"38.2216,-80.9096",,-3.364020000000004,similar,1673
Bolar Mountain Recreation Area,USFS campground on the shore of Lake Moomaw with sites directly on the lake shoreline.  Route 603 NW of the campground is a narrow one-lane gravel road with steep drop-offs not suitable for RVs.  Campground should be accessed from route 600 instead. --AWH,VA,federal,lake,"37.9848,-79.9696",,-2.8090799999999994,similar,1637
Assateague State Park,Some sites are oceanfront but view and access are blocked by dunes --AWH,MD,state,ocean,"38.2374,-75.1374",,2.5745399999999985,similar,0
North Bend Park & Campground,COE-style campground with many lakefront sites --AWH,VA,federal,lake,"36.5861,-78.3081",,4.435379999999998,slightly warmer,311
Crabtree Falls Campground,"Closed for 2025 due to hurricane Helene
Blue Ridge Parkway campground in a wooded mountain setting; while there is a creek in the area, the campsites are in a standard NPS loop layout set back from the water. --AWH",NC,federal,none,"35.8123,-82.1440","https://www.nps.gov/blri/planyourvisit/crabtree-falls-cg.htm
https://www.recreation.gov/camping/campgrounds/258667",-6.222779999999999,slightly cooler,3691
Lover's Leap Campground,Two camp loops on a hill in a wooded area --AWH,VA,federal,none,"36.7022,-82.7380",,-1.2023999999999955,similar,1834
San Carlos RV Park & Islands,Waterfront RV park in the Fort Myers Beach area with sites directly on San Carlos Bay. --AWH,FL,private,bay,"26.4683,-81.9495",,23.688720000000004,hot,19
Gulf Air,Campground is not on the water --AWH,FL,private,none,"26.4901,-81.9408",,23.67288,hot,13
Koreshan State Park,Campground is in a wooded area --AWH,FL,state,none,"26.4340,-81.8157",,23.691959999999998,hot,36
Periwinkle Park Campground,Interior campground on Sanibel Island; not directly on the beach or bay. --AWH,FL,private,none,"26.4440,-82.0427",,23.74416,hot,16
Ohiopyle State Park Kentuck Campground,Kentuck Campground is on a ridge/plateau away from the Youghiogheny River. --AWH,PA,state,none,"39.8888,-79.4945",,-6.318180000000006,slightly cooler,1660
Laurel Hill State Park Campground,The park has Laurel Hill Lake but the campground is set back in the woods; the lake and beach area are a walk from the campground loops. --AWH,PA,state,none,"39.9922,-79.2421",,-7.615799999999994,slightly cooler,1971
Vermilion Travel Plaza,"Travel plaza-style campground in Vermilion, OH; not a waterfront campground. --AWH",OH,private,none,"41.3776,-82.2244",,-5.698620000000002,slightly cooler,734
Findley State Park,Findley State Park has Findley Lake but the campground is in a standard wooded loop design set back from the lakeshore. --AWH,OH,state,none,"41.1314,-82.2087",,-5.758559999999999,slightly cooler,876
Silver Springs Campground,"Private campground near Stow/Akron, OH; no significant water body indicated. --AWH",OH,private,none,"41.1939,-81.4057",,-6.690059999999999,slightly cooler,1105
Wilderness State Park Campground,Lakeshore campground loop has sites right on the Lake Michigan beach near Mackinaw City. --AWH,MI,state,lake,"45.7444,-84.9022",,-13.125959999999997,cooler,613
Pokagon State Park,The campground on Lake James does not have sites directly on the lake; the campground is set back in the woods. --AWH,IN,state,none,"41.7044,-85.0288",,-7.351559999999998,slightly cooler,1033
Harrison Lake State Park,"Some campsites in the South Campground are lakefront, but vegetation or berms may block the view. --AWH",OH,state,lake,"41.6443,-84.3719",,-6.436080000000002,slightly cooler,807
Indiana Dunes State Park Campground Showers and Bathrooms,"While the park is on Lake Michigan, the campground is set back in the dunes/woods behind the beach. --AWH",IN,state,none,"41.6576,-87.0554",,-5.8282200000000035,slightly cooler,629
Straits State Park,A small number of non-electric tent/RV sites are directly on the lake. --AWH,MI,state,lake,"45.8551,-84.7195",,-13.52412,cooler,669
West Branch State Park Campground,The park has a reservoir but the campground is in a standard wooded loop layout not directly on the shoreline. --AWH,OH,state,none,"41.1428,-81.1129",,-6.399180000000002,slightly cooler,1049
Covert Township Park,Small campground set back in a wooded area a short walk from the lake. --AWH,MI,local,none,"42.2993,-86.3259",,-7.065180000000004,slightly cooler,652
Van Buren State Park,Campground is set back in a wooded area a short walk from the lake. --AWH,MI,state,none,"42.3346,-86.3006",,-7.140420000000003,slightly cooler,656
Illinois Beach State Park Campground,Campsites are lakefront but are set behind dunes and some vegetation. --AWH,IL,state,lake,"42.4366,-87.8071",,-7.113419999999997,slightly cooler,597
Warren Dunes State Park Campground,"While the park is on Lake Michigan, the campground is set back from the beach in a wooded area behind the substantial dunes. --AWH",MI,state,none,"41.9100,-86.5871",,-6.282539999999994,slightly cooler,629
North Pointe RV Resort,"Inland RV resort near Selma/Smithfield, NC; not on a significant body of water. --AWH",NC,private,none,"35.5319,-78.2632",,6.824339999999999,slightly warmer,173
Kohler-Andrae State Park,Campground is close to the lakeshore but is set back in a wooded area. --AWH,WI,state,none,"43.6651,-87.7192",,-9.336420000000004,cooler,600
Point Beach Campground,Campground is close to the lakeshore but is set back in a wooded area. --AWH,WI,state,none,"44.1827,-87.5273",,-10.314899999999994,cooler,613
Hoeft State Park,Campground on Lake Huron with sandy beach and sites adjacent to the lake.  View may be blocked by trees or dunes. --AWH,MI,state,lake,"45.4637,-83.8836",,-12.737700000000006,cooler,646
Maumee Bay State Park,Campground on Maumee Bay of Lake Erie.  Campsites are not waterfront. --AWH,OH,state,none,"41.6789,-83.3740",,-5.667659999999997,slightly cooler,574
Twelvemile Beach Campground,Pictured Rocks campground perched on a bluff directly above the Lake Superior beach.  Some sites are lakefront but are set back slightly into the woods. --AWH,MI,federal,lake,"46.6398,-86.2157",,-14.702580000000001,much cooler,603
Munising Tourist Park Campground,Municipal campground right on the shore of Lake Superior in Munising Bay with several waterfront sites. --AWH,MI,local,lake,"46.4410,-86.6774",,-14.297940000000004,much cooler,590
Hurricane River Campground,Pictured Rocks campground at the mouth of Hurricane River.  All campsites are set back in the woods. --AWH,MI,federal,none,"46.6656,-86.1667",,-14.737319999999997,much cooler,600
Woodland Park Campground,Municipal campground in Grand Marais.  All sites are separated from the lake by a driveway. --AWH,MI,local,lakeview,"46.6733,-85.9911",,-14.891579999999996,much cooler,639
Harrisville State Park,Campground with some sites directly adjacent to the sandy Lake Huron beach. --AWH,MI,state,lake,"44.6475,-83.2976",,-11.256840000000002,cooler,643
Muskallonge Lake State Park,Many waterfront sites on Muskallonge Lake.  Lake Superior is a short walk away. --AWH,MI,state,lake,"46.6766,-85.6281",,-14.874120000000001,much cooler,633
Tawas Point Campground,Campground on a sandy point extending into Lake Huron.  At least a few sites are directly on the lake. --AWH,MI,state,lake,"44.2577,-83.4448",,-10.3563,cooler,587
Bill and Nancy Snyder's property,Private property in western PA; no indication of waterfront. --AWH,PA,private,none,"41.2152,-80.3134",,-7.009200000000005,slightly cooler,1184
Dunewood Campground,Indiana Dunes National Park campground set back from Lake Michigan in a wooded area. --AWH,IN,federal,none,"41.6709,-86.9829",,-5.934060000000006,slightly cooler,652
Gamble Rogers,"About half the sites in the beachside loop are oceanfront, but dunes and vegetation may block the view. --AWH",FL,state,ocean,"29.4380,-81.1100",,18.343260000000004,much warmer,19
Cypress Glen Campground,"Withlacoochee State Forest campground in a forested setting, not directly on a lake or river. --AWH",FL,state,none,"28.5704,-82.2115",,19.63584,hot,95
Hillsborough River State Park,The river runs through the park but the campground is a standard loop set back in the woods; sites are not directly on the riverbank. --AWH,FL,state,none,"28.1427,-82.2272",,20.452499999999997,hot,82
Cheraw State Park,several sites are right on the lake --AWH,SC,state,lake,"34.6410,-79.9006",,8.568360000000004,slightly warmer,134
Jekyll Island Campground,Campground in the interior of Jekyll Island surrounded by live oaks; not directly on the beach or marsh. --AWH,GA,local,none,"31.1075,-81.4128",,15.209459999999996,much warmer,55
Pocahontas State Park,The park has lakes but the campground is set back in the woods; not lakefront. --AWH,VA,state,none,"37.3724,-77.5715",,3.101940000000002,similar,288
The Real Lake Aire RV Park,There are several lakefront RV sites. --AWH,SC,private,lake,"32.7774,-80.1467",,12.26214,warmer,39
Seven Points Campground,Raystown Lake COE campground w/many waterfront sites --AWH,PA,federal,lake,"40.3937,-78.0932",,-5.4603000000000055,slightly cooler,1164
Geneva State Park Campground,There are a few rather expensive full-hookup sites that are lakefront.  The rest are set back from the lake in a wooded area. --AWH,OH,state,lake,"41.8511,-80.9873",,-6.047820000000004,slightly cooler,593
East Harbor State Park,The campground is inland from Lake Erie in a wooded area; the beach is separate from the camping area. --AWH,OH,state,none,"41.5446,-82.8203",,-5.4493200000000055,slightly cooler,580
Kelleys Island State Park,"Campground has waterfront tent sites, but RV sites are set back a ways from the water. --AWH",OH,state,lakeview,"41.6144,-82.7062",,-5.598360000000007,slightly cooler,587
South Bass Island State Park,"Campground has waterfront tent sites, but RV sites are set back a ways from the water. --AWH",OH,state,lakeview,"41.6427,-82.8355",,-5.637599999999996,slightly cooler,584
Yellow Creek Campground,Wooded campground across from Yellow Creek State Park.  Some sites along a creek. --AWH,PA,federal,creek,"40.5842,-79.0006",,-6.353100000000004,slightly cooler,1318
Blackwater Falls Campground,"lodge: 304-259-5216
Mountain campground near the falls but not waterfront. --AWH",WV,state,none,"39.1165,-79.4895",https://book.wvstateparks.com/ecomm/listings/supplierdetail/7816932/en-US/?supplierid=11067324,-10.286640000000004,cooler,3162
Holden Beach Pier Campground,Located on the Holden Beach barrier island directly on the Atlantic Ocean.  (910) 842-6488.  Six RV sites. --AWH,NC,local,ocean,"33.9111,-78.2972","https://www.ncbrunswick.com/places-to-stay/camping-rv/
https://hbtownhall.com/parks-%26-recreation",10.361880000000005,warmer,0
Carolina Beach State Park,The park is on the Cape Fear River but the campground is set back in the maritime forest; campsites are not directly on the water. --AWH,NC,state,none,"34.0459,-77.9139",,10.072439999999995,warmer,13
Cherry Hill Recreation Area,USFS campground in Sumter National Forest with some campsites along a small creek. --AWH,SC,federal,creek,"34.9417,-83.0875",,0.433800000000005,similar,2263
Fore Lake Campground,"This park is on a lake, but the campground is not lakefront --AWH",FL,federal,none,"29.2737,-81.9204",,18.334799999999998,much warmer,104
Alexander Springs Recreation Area,Ocala National Forest campground near the beautiful turquoise waters of Alexander Springs.  Campsites are not waterfront. --AWH,FL,federal,none,"29.0803,-81.5776",,18.799919999999997,much warmer,72
Jack Hill State Park,"The park has a mill pond/lake but the campground is set back in the woods, not directly on the water. --AWH",GA,state,none,"32.0844,-82.1255",,12.936239999999996,warmer,200
Campbell's Lake,"Large waterfront site w/shelter, picnic table, fireplace, trash can, on beautiful cypress lake.
$15/night.
Reservations by phone only: 843-498-6478. --AWH",SC,state,lake,"34.5951,-79.9832",https://www.scfc.gov/state-lands/sand-hills-state-forest/sand-hills-state-forest-campsite-information/,8.639279999999998,slightly warmer,137
