name,note,state,ownership,waterfront,location,website,delta_temp,climate,elevation_feet
Letchworth State Park Campground,"Recommended in _Where_Should_We_Camp_Next?_ by Stephanie Puglisi
Campground is on the plateau above the Genesee River gorge; the park is famous for waterfalls but the campground is not on the river.",NY,state,none,"42.6975,-77.9373",,-8.717939999999995,slightly cooler,915
Killens Pond State Park Campground,"There is a pond in the park, but the campground is not waterfront.  Recommended in _Where_Should_We_Camp_Next?_ by Stephanie Puglisi",DE,state,none,"38.9745,-75.5350",,1.0956600000000019,similar,42
Tygart Lake State Park,"The park is on a lake, but the campground is not.",WV,state,none,"39.2802,-80.0108",,-3.409200000000001,similar,1151
North Creek Campground,Small USFS campground in the George Washington National Forest with sites positioned directly along North Creek.,VA,federal,creek,"37.5419,-79.5834",https://www.fs.usda.gov/r08/gwj/recreation/north-creek-campground,-0.3504599999999966,similar,1171
Cave Mountain Lake Family Camp,"There is a small lake nearby, but the campground is not on the lake.",VA,federal,none,"37.5757,-79.5346",https://www.fs.usda.gov/r08/gwj/recreation/cave-mountain-lake-recreation-area,-0.7037999999999957,similar,1253
Sherando Lake Recreation Area,"There are two small lakes nearby, but the campground is not on the lake.",VA,federal,none,"37.9195,-79.0073",,-3.5573399999999986,similar,1880
Campground at James Island County Park,"Recommended in _Where_Should_We_Camp_Next?_ by Stephanie Puglisi
Large campground in the interior of the park; while the park is on an island with marsh areas, the campground is not directly waterfront.",SC,local,none,"32.7369,-79.9924",,12.440340000000003,warmer,9
Paris Mountain State Park Campground,"Recommended in _Where_Should_We_Camp_Next?_ by Stephanie Puglisi
Campground is in a wooded area on the mountain; the park's lakes are separate from the camping area.",SC,state,none,"34.9251,-82.3744",,4.6639800000000005,slightly warmer,1086
Canaan Loop Road dispersed campsite #1,"Smallish heavily-wooded back-in site with a fairly level parking area.  Stopped here briefly on the morning of April 6, 2025 and had dinner here on the evening of November 8, 2025",WV,federal,none,"39.0889,-79.4531",https://www.fs.usda.gov/r09/monongahela/recreation/canaan-mountain-backcountry,-12.214260000000005,cooler,3717
Canaan Loop Road dispersed campsite #2,,WV,federal,none,"39.0846,-79.4591",https://www.fs.usda.gov/r09/monongahela/recreation/canaan-mountain-backcountry,-12.218220000000002,cooler,3720
Canaan Loop Road dispersed campsite #3,,WV,federal,none,"39.0818,-79.4625",https://www.fs.usda.gov/r09/monongahela/recreation/canaan-mountain-backcountry,-12.189780000000003,cooler,3714
Canaan Loop Road dispersed campsite #4,,WV,federal,none,"39.0776,-79.4666",https://www.fs.usda.gov/r09/monongahela/recreation/canaan-mountain-backcountry,-12.205619999999994,cooler,3720
Canaan Loop Road dispersed campsite #5,"Small site right along the side of the road with almost no trees and a big view of sky.  Camped here on November 8, 2025",WV,federal,none,"39.0726,-79.4732",https://www.fs.usda.gov/r09/monongahela/recreation/canaan-mountain-backcountry,-11.939220000000002,cooler,3648
Canaan Loop Road dispersed campsite #6,"Medium-sized site with almost no trees and a big view of the sky.  Camped here on April 5, 2025",WV,federal,none,"39.0722,-79.4736",https://www.fs.usda.gov/r09/monongahela/recreation/canaan-mountain-backcountry,-11.938500000000005,cooler,3648
Canaan Loop Road dispersed campsite #7,,WV,federal,none,"39.0693,-79.4767",https://www.fs.usda.gov/r09/monongahela/recreation/canaan-mountain-backcountry,-12.167279999999996,cooler,3714
Canaan Loop Road dispersed campsite #8,,WV,federal,none,"39.0680,-79.4854",https://www.fs.usda.gov/r09/monongahela/recreation/canaan-mountain-backcountry,-11.895839999999996,cooler,3638
Canaan Loop Road possible dispersed campsite,,WV,federal,creek,"39.0643,-79.5059",https://www.fs.usda.gov/r09/monongahela/recreation/canaan-mountain-backcountry,-11.035080000000006,cooler,3399
Canaan Loop Road dispersed campsite #12,Beautiful site at the confluence of two creeks,WV,federal,creek,"39.0570,-79.5182",https://www.fs.usda.gov/r09/monongahela/recreation/canaan-mountain-backcountry,-10.635840000000004,cooler,3290
Bluestone State Park,Campground on Bluestone Lake (USACE reservoir) with lakeside campsites.,WV,state,lake,"37.6170,-80.9205",,-4.089239999999995,slightly cooler,2181
Dick Cross Wildlife Management Area,Small WMA in the Virginia Piedmont; dispersed camping is not documented as waterfront.,VA,state,none,"36.6166,-78.2875",https://tmbtent.com/virginia-free-dispersed-camping/,4.591080000000003,slightly warmer,252
Rapidan WMA,"Rapidan WMA permit required
WMA dispersed camping area; sites are parking-area based and not confirmed to be directly on the Rapidan River.",VA,state,none,"38.4212,-78.4062",https://tmbtent.com/virginia-free-dispersed-camping/,-3.524399999999998,similar,1617
White Oak Mountain Wildlife Management Area,Mountain/upland WMA; no waterfront features noted.,VA,state,none,"36.7900,-79.3297",https://tmbtent.com/virginia-free-dispersed-camping/,2.1846600000000023,similar,839
Amelia Wildlife Management Area,"One of the best dispersed camping areas in VA according to tmbtent.com
Multiple parking areas, including one on the lake.
Note indicates a parking area directly on the lake.",VA,state,lake,"37.4674,-77.9110",https://dwr.virginia.gov/wma/amelia/,2.790540000000004,similar,328
Walnut Flats Campground,USFS campground along Stony Creek in Jefferson National Forest with sites in the creek valley.,VA,federal,creek,"37.1991,-80.8851",https://tmbtent.com/virginia-free-dispersed-camping/,-4.144320000000002,slightly cooler,2408
Scotchtown Draft dispersed camping area,"Sites on the north side of the road have great views, and the site closest to the river has water access.
Note confirms the site closest to the river has water access.",VA,federal,river,"38.1539,-79.5968",https://tmbtent.com/virginia-free-dispersed-camping/,-2.78586,similar,1545
Oronoco Campground,Dispersed camping area in the Blue Ridge Mountains; no waterfront features documented.,VA,federal,none,"37.7479,-79.2648",https://tmbtent.com/virginia-free-dispersed-camping/,-2.675160000000002,similar,1719
Chickahominy Riverfront Park,"One of VA's best RV campgrounds according to campingprepper.com
Multiple riverfront sites (106-118 suitable for campervans).",VA,local,river,"37.2652,-76.8722",https://www.jamescitycountyva.gov/4149/Chickahominy-Riverfront-Park,4.2426,slightly warmer,22
Black Mountain Campground,"Closed for 2025 due to Helene storm damage
USFS campground in Pisgah National Forest with sites directly along the South Toe River.",NC,federal,creek,"35.7516,-82.2209","https://www.fs.usda.gov/r08/northcarolina/recreation/black-mountain-campground
https://www.recreation.gov/camping/campgrounds/273780
https://campingprepper.com/asheville-nc-campgrounds/",-3.761820000000005,similar,3031
Mount Pisgah Campground,High-elevation Blue Ridge Parkway campground with no water bodies adjacent.,NC,federal,none,"35.4029,-82.7568","https://www.recreation.gov/camping/campgrounds/234182
https://campingprepper.com/asheville-nc-campgrounds/",-9.966960000000004,cooler,4947
Powhatan State Park,The park is on the James River but the campground sites are on a bluff/wooded area above the river; sites are not directly on the water.,VA,state,none,"37.6865,-77.9247","https://www.dcr.virginia.gov/state-parks/powhatan
https://www.reservevaparks.com/Web/#!park/26",2.712059999999996,similar,239
Cross Rip Campground,Private campground right on the bay with a few waterfront sites.  Slightly pricey but not outrageous given facilities and location.,VA,private,bay,"37.5486,-76.3100",https://crossripcamp.com/,3.75588,similar,16
Lake Powhatan Recreation Area & Campground,"There is a small lake nearby, but the campground is not on the lake.",NC,federal,none,"35.4877,-82.6297",https://campingprepper.com/asheville-nc-campgrounds/,-0.8414999999999933,similar,2345
Wilson's Riverfront RV Park,"$40 primitive riverside RV sites.
Name says Riverfront; note describes primitive riverside RV sites on the French Broad River.",NC,private,river,"35.5660,-82.5874",https://campingprepper.com/asheville-nc-campgrounds/,0.32795999999999587,similar,1978
Hog Island Wildlife Management Area - Carlisle Tract,Low-lying WMA peninsula on the James River estuary near the Chesapeake Bay with multiple camping areas along a dedicated fishing beach.,VA,state,bay,"37.1445,-76.6848",,4.471559999999999,slightly warmer,19
Chickahominy Wildlife Management Area,WMA along the Chickahominy River with one riverfront camping/parking spot just north of the Eagle Bottom area.,VA,state,river,"37.3176,-76.9127",,4.042980000000002,slightly warmer,52
Hardware River Wildlife Management Area,"WMA near the Hardware River, but camping is parking-area based and not confirmed to be directly on the water.",VA,state,none,"37.7568,-78.4286",,2.2345200000000034,similar,337
Featherfin Wildlife Management Area,"WMA near the Briery Creek watershed, but camping is not confirmed to be directly lakeside.",VA,state,none,"37.3741,-78.5803",,2.6776800000000027,similar,406
Twin Lakes State Park,Park is located on a lake.  Campground is not lakefront.,VA,state,none,"37.1756,-78.2787","https://www.dcr.virginia.gov/state-parks/twin-lakes
https://www.reservevaparks.com/Web/#!park/34",2.660579999999995,similar,511
Bear Creek Lake State Park,"Multiple waterfront sites on Bear Creek Lake
Campground is closed for renovations until summer 2026",VA,state,lake,"37.5320,-78.2732","https://www.dcr.virginia.gov/state-parks/bear-creek-lake
https://www.reservevaparks.com/Web/#!park/1",2.6742600000000065,similar,328
Holliday Lake State Park,Park is located on a lake.  Campground is not lakefront.,VA,state,none,"37.3980,-78.6414","https://www.dcr.virginia.gov/state-parks/holliday-lake
https://www.reservevaparks.com/Web/#!park/13",2.131559999999994,similar,547
Briery Creek Wildlife Management Area,WMA centered on the 845-acre Briery Creek Lake with camping access near the lake.,VA,state,lake,"37.1967,-78.4373",,2.6577,similar,501
Bath County Recreational Campground,County campground in the mountains of Bath County; no waterfront features documented.,VA,local,none,"38.1855,-79.8263",,-4.679639999999996,slightly cooler,2060
Bandits Roost Campground,USACE campground on W. Kerr Scott Reservoir with lakefront sites on the shoreline.,NC,federal,lake,"36.1252,-81.2428","https://www.saw.usace.army.mil/Locations/District-Lakes-and-Dams/W-Kerr-Scott/Recreation/Recreation-Areas/
https://www.recreation.gov/camping/campgrounds/233421",2.632500000000001,similar,1049
Fairy Stone State Park,Campground with sites along Fairy Stone Lake.,VA,state,lake,"36.7884,-80.0947",,0.8888399999999953,similar,1204
Falls Lake State Recreation Area,,NC,state,lake,"36.0230,-78.6994",,5.273459999999995,slightly warmer,360
Chestnut Ridge Regional Park,"campingprepper.com/best-west-virginia-rv-campgrounds
Ridge-top park near Morgantown; no significant water bodies at the campground.",WV,local,none,"39.6803,-79.7806",,-7.920180000000004,slightly cooler,2214
Pipestem Campground,"campingprepper.com/best-west-virginia-rv-campgrounds
Campground on a mountain plateau above the Bluestone River gorge; far above the river.",WV,state,none,"37.5187,-80.9820",,-5.994900000000005,slightly cooler,2765
Lake Sherwood Recreation Area,"One of WV's best campgrounds
Several campsites are right on the lake",VA,federal,lake,"38.0063,-80.0109",,-6.767280000000005,slightly cooler,2736
Holly River State Park,"campingprepper.com/best-west-virginia-rv-campgrounds
Campground in a narrow valley along the Left Fork of Holly River with some sites along the creek.",WV,state,creek,"38.6653,-80.3545",,-4.3966800000000035,slightly cooler,1738
Summersville Lake Retreat & Lighthouse,Voted best campground in WV by campingprepper.com.  Primitive campsites seem to be available at a reasonable price for small RVs.  No lakefront sites.,WV,private,none,"38.1995,-80.8666",,-4.622940000000001,slightly cooler,2037
Bulltown Campground,"One of WV's best campgrounds according to campingprepper.com
Multiple lakefront campsites",WV,federal,lake,"38.7935,-80.5614",https://www.recreation.gov/camping/campgrounds/233443,-1.5737400000000026,similar,882
Baker's Run Campground,"campingprepper.com/best-west-virginia-rv-campgrounds
USACE campground on the Elk River/Burnsville Lake area with waterfront sites.",WV,federal,river,"38.6348,-80.5746",,-1.4869799999999969,similar,938
Big Bend Campground,"campingprepper.com/best-west-virginia-rv-campgrounds
USFS campground along the South Branch of the Potomac River in the Smoke Hole canyon with sites adjacent to the water.",WV,federal,river,"38.8897,-79.2388",,-3.0455999999999954,similar,1246
Spruill Farm Landing,"Spruill Conservation Farm in Hipcamp.  Beautiful soundfront views.
Soundfront property on the Albemarle Sound with waterfront views.",NC,private,bay,"35.9416,-76.5756",,6.683579999999998,slightly warmer,6
1560 Fire Trail Rd,"County Line Parking Area, Thompson WMA, permit required",VA,state,none,"38.9807,-78.0037",,-5.631299999999998,slightly cooler,1925
1690 Fire Trail Rd,"Appalachian Trail Parking Area, Thompson WMA, permit required",VA,state,none,"38.9854,-77.9996",,-5.312159999999997,slightly cooler,1834
1868 Fire Trail Rd,"Orchard Parking Area, Thompson WMA, permit required",VA,state,none,"38.9918,-77.9946",,-5.019479999999995,slightly cooler,1748
300 Fire Trail Rd,"Ridge Parking Area, Thompson WMA, permit required",VA,state,none,"38.9676,-78.0183",,-6.028919999999995,slightly cooler,2044
630 Fire Trail Rd,"Rock Spring Parking Area, Thompson WMA, permit required",VA,state,none,"38.9716,-78.0176",,-6.059520000000004,slightly cooler,2050
Cherry Springs State Park Rustic Campground,"Cherry Springs State Park is nearly as remote and wild today as it was two centuries ago. Its dark skies make it a haven for astronomers. Due to its exceptionally dark skies, Cherry Springs State Park is one of the best places on the eastern seaboard for stargazing and the science of astronomy",PA,state,none,"41.6633,-77.8193",,-11.828879999999998,cooler,2309
Watchman Campground,"This Zion National Park campground nestled at the base of the iconic Watchman Peak offers dramatic views of red sandstone cliffs. The towering formations create a breathtaking backdrop, especially at sunrise or sunset.",UT,federal,none,"37.1964,-112.9876",,-9.556559999999996,cooler,3927
North Rim Campground,"Perched on the quieter, less-visited North Rim, this campground provides jaw-dropping vistas of the Grand Canyons vast expanse. The elevation and remoteness enhance the sweeping views of the canyons layered cliffs.",AZ,federal,none,"36.2088,-112.0602",,-23.503679999999992,much cooler,8337
Silver Bell,"Located near Aspen, this campground frames the iconic Maroon Bellstwin peaks rising above Maroon Lake. The rugged Elk Mountains and golden aspens in fall make it a postcard-worthy spot.  Not lakefront.",CO,federal,none,"39.1428,-106.8953",,-29.42838,much cooler,8517
Kirk Creek Campground,"Perched high above the Pacific Ocean along the rugged Big Sur coast, this spot offers RV sites with panoramic views of waves crashing against the cliffs below.",CA,federal,ocean,"35.9900,-121.4957",,5.754059999999996,slightly warmer,242
Many Glacier Campground,Stunning views of Glacier's iconic mountains.  Several campsites are right on the creek.  A lake is nearby.,MT,federal,creek,"48.7967,-113.6773",,-34.00560000000001,much cooler,4928
Tuolumne Meadows Campground,"High in the Sierra Nevada, this Yosemite campground features sweeping views of granite domes, meadows, and waterfalls.  Site A028 is the only RV site that backs up directly to the river.",CA,federal,river,"37.8712,-119.3577",,-27.619200000000003,much cooler,8651
Kalaloch Campground,"Olympic National Park campground overlooking the Pacific Ocean, this campground provides dramatic coastal views from bluff-top sites.",WA,federal,ocean,"47.6130,-124.3761",,-14.47704,much cooler,49
Kayenta Campground,"Just outside Arches and Canyonlands, this campground overlooks the Colorado Rivers dramatic 2,000-foot cliffs. The sunrise casts a fiery glow over the desert landscape, rivaling the Grand Canyon in grandeur.
Campground on a mesa top far above the Colorado River; not at river level.",UT,federal,none,"38.4860,-109.7404",,-19.178639999999994,much cooler,5974
Juniper Springs Campground,Ocala National Forest campground adjacent to the crystal-clear Juniper Springs Run.  Campsites are not waterfront.,FL,federal,none,"29.1839,-81.7120",,18.613439999999997,much warmer,72
Paynetown Campground,"Situated on Indiana's largest lake, this campground offers several lakefront campsites.",IN,state,lake,"39.0773,-86.4419",https://indianastateparks.reserveamerica.com/,-0.8443800000000017,similar,534
Houchin Ferry Campground,NPS campground in Mammoth Cave National Park with waterfront sites along the Green River.,KY,federal,river,"37.2015,-86.2377",,2.754359999999995,similar,472
Savanna Portage State Park Campground,"East of the Mississippi in northern Minnesota, this campground overlooks shimmering lakes surrounded by dense woods. The peaceful water views and vibrant autumn colors stand out.
Campground with lakefront sites on Savanna Lake.",MN,state,lake,"46.8264,-93.1515",,-17.565659999999998,much cooler,1312
Davidson River Campground,"USFS campground in Pisgah National Forest.  The Davidson river runs alongside the campground, but sites are set back behind vegetation and a trail.",NC,federal,none,"35.2812,-82.7226",,0.16200000000000375,similar,2168
Cranberry Lake Campground,Most campsites are right on the lake,NY,state,lake,"44.2055,-74.8312",,-13.90104,cooler,1607
Elkmont Campground,Great Smoky Mountains campground with some RV sites directly along the Little River.,TN,federal,river,"35.6577,-83.5835",,-0.8432999999999963,similar,2260
Orchard Beach State Park,"Campground is on a tall, steep bluff high above Lake Michigan; Some RV sites are right on the edge of the bluff.  The lake is visible from some sites, but the beach is far below and is no longer accessible due to erosion.",MI,state,lake,"44.2817,-86.3153",,-10.668600000000001,cooler,662
Apgar Campground,Glacier National Park campground near the foot of Lake McDonald; Campsites are not directly on the lake.,MT,federal,none,"48.5263,-113.9820",,-27.352979999999995,much cooler,3198
Hither Hills State Park Campground,"Campsites are close to the beach, but view and access are blocked by dunes",NY,state,ocean,"41.0085,-72.0102",,-2.565539999999996,similar,42
Cape Lookout State Park Campground,"Campsites are close to the beach, but view and access are blocked by dunes",OR,state,ocean,"45.3660,-123.9687",,-10.38564,cooler,36
Devil's Lake State Park,"There is a lake in the park, but the campground is not lakefront.",WI,state,none,"43.4284,-89.7314",,-10.290960000000007,cooler,987
Deception Pass Camp,"Campground loops are set back in the forest, not directly on Cranberry Lake's shoreline.",WA,state,none,"48.3994,-122.6593",,-16.068060000000003,much cooler,98
Jumbo Rocks Campground,Desert campground in Joshua Tree National Park with no water bodies.,CA,federal,none,"33.9917,-116.0628",,-5.355900000000002,slightly cooler,4367
Sage Creek Campground,Primitive grassland campground in the Badlands; Sage Creek is intermittent and often dry.,SD,federal,none,"43.8941,-102.4144",,-16.663320000000002,much cooler,2539
Molly Stark State Park,Mountain-top park on Mount Olga with no significant water bodies.,VT,state,none,"42.8525,-72.8149",,-12.460139999999999,cooler,1886
Lake St. Catherine State Park,A small number of campsites are either lakefront or creekfront.  Trees may obstruct the view.,VT,state,lake,"43.4816,-73.2049",,-8.725320000000002,slightly cooler,521
Emerald Lake State Park,"There is a lake in the park, but the campground is not lakefront.",VT,state,none,"43.2808,-73.0049",,-9.27648,cooler,777
Coolidge State Park,Forested mountainside park with no water bodies at the campground.,VT,state,none,"43.5517,-72.6975",,-13.016699999999995,cooler,1689
Jamaica State Park,Campground along the West River with riverside campsites directly on the riverbank.,VT,state,river,"43.1057,-72.7733",,-8.610299999999997,slightly cooler,679
Pine Grove Furnace State Park,Campground is in a wooded area set back from Laurel and Fuller Lakes; campers walk to the lakes.,PA,state,none,"40.0321,-77.2928",,-3.75642,similar,869
Weiser State Forest (Halderman Tract) Campsite H4 Tract),Dispersed state forest campsite; no waterfront features documented.,PA,state,none,"40.5095,-76.7498",,-6.7451400000000055,slightly cooler,1466
Weiser State Forest Greenland Tract,Dispersed state forest campsite; no waterfront features documented.,PA,state,none,"40.5674,-76.6026",,-7.200359999999999,slightly cooler,1565
Locust Lake State Park Campground,Some campsites are close to the lake but not officially lakefront.,PA,state,none,"40.7850,-76.1195",,-6.480539999999993,slightly cooler,1253
Frances Slocum State Park,The park has Frances Slocum Lake but the campground is set back from the lake in wooded hills.,PA,state,none,"41.3407,-75.8926",,-7.071299999999996,slightly cooler,1138
Lackawanna State Park,The park has Lackawanna Lake but the campground area is in the hills above the lake.,PA,state,none,"41.5627,-75.7067",,-6.8858999999999995,slightly cooler,974
Salt Springs State Park,"The park features Fall Brook with waterfalls but the camping area is in the woods, not directly on the brook.",PA,state,none,"41.9118,-75.8652",,-8.40348,slightly cooler,1223
Lake George Battleground State Campground,Wooded campground right in town.  Walk to lake or downtown area.  Campsites are not lakefront.,NY,state,none,"43.4148,-73.7121",,-8.172179999999999,slightly cooler,400
Robert Moses State Park - Thousand Islands,,NY,state,river,"45.0013,-74.8507",,-10.489680000000002,cooler,249
Coles Creek State Park,,NY,state,river,"44.8936,-75.1381",,-10.307519999999998,cooler,252
Keewaydin State Park,,NY,state,river,"44.3238,-75.9349",,-9.352079999999999,cooler,272
Kring Point State Park,,NY,state,river,"44.3762,-75.8584",,-9.376199999999995,cooler,252
Jacques Cartier State Park,,NY,state,river,"44.5614,-75.6846",,-9.768059999999998,cooler,269
Dewolf Point State Park,"Park is on a lake, but none of the campsites are lakefront.",NY,state,none,"44.3323,-75.9908",,-9.308879999999993,cooler,255
Wellesley Island State Campground,numerous riverfront campsites with direct access to the water,NY,state,river,"44.3292,-76.0366",,-9.3384,cooler,265
Grass Point State Park,"Many sites adjacent to the river, but most are separated from the river by either the marina or the driveway.",NY,state,riverview,"44.2798,-75.9990",,-9.226080000000003,cooler,259
Southwick Beach State Park,"Some sites are lakefront but the view may be blocked by dunes, and the beach can only be accessed via marked trails.",NY,state,lake,"43.7668,-76.2090",,-8.337780000000006,slightly cooler,269
Fair Haven Beach State Park,"There are several sites up on the bluff, adjacent to the lake, but they are separated from the lake by the driveway and vegetation may block the view.",NY,state,lakeview,"43.3303,-76.6966",,-7.680780000000002,slightly cooler,305
Hamlin State Park Campground,Campground is set back from the Lake Ontario shore in wooded loops; the beach is accessed via a walk.,NY,state,none,"43.3591,-77.9500",,-7.685819999999997,slightly cooler,292
Four Mile Creek State Park,Campground loops are set back from the Lake Ontario bluff; sites are not directly on the lakeshore.,NY,state,none,"43.2736,-78.9960",,-7.461720000000004,slightly cooler,272
Evangola State Park Campground,The park is on Lake Erie but the campground is set back from the bluff/shoreline in wooded loops.,NY,state,none,"42.6021,-79.1178",,-7.35282,slightly cooler,580
Macomb Reservation State Park,Forested inland park; no documented waterfront camping.,NY,state,none,"44.6157,-73.6078",,-11.375099999999994,cooler,692
Bowman Lake State Park,Lake is nearby but not within campground.,NY,state,none,"42.5169,-75.6784",,-11.35296,cooler,1745
Selkirk Shores State Park,"There are several sites on the bluff overlooking the lake, but the view may be partially blocked by vegetation.",NY,state,lake,"43.5531,-76.2056",,-8.11692,slightly cooler,314
Oquaga Creek State Park,"Campground is in a wooded area on a ridge, not along the creek.",NY,state,none,"42.1879,-75.4188",,-10.573559999999997,cooler,1692
Gilbert Lake State Park,Lake is nearby but not within campground.,NY,state,none,"42.5901,-75.1341",,-11.192219999999999,cooler,1663
Glimmerglass State Park,Campground on the shore of Otsego Lake near Cooperstown with lakeside sites.,NY,state,lake,"42.7867,-74.8621",,-10.060200000000005,cooler,1246
Delta Lake State Park,Multiple lakefront campsites,NY,state,lake,"43.2904,-75.4167",,-8.498159999999997,slightly cooler,554
Chenango Valley State Park,The park has Lily Lake but the campground is set back in the wooded area away from the lake.,NY,state,none,"42.2156,-75.8342",,-7.897320000000004,slightly cooler,928
Green Lakes State Park,Lakes are nearby but not within campground.,NY,state,none,"43.0582,-75.9715",,-7.857899999999998,slightly cooler,492
Lake Erie State Park,"There are a small number of lakefront campsites, all of which are up on a bluff overlooking the lake.",NY,state,lake,"42.4215,-79.4298",,-7.226640000000003,slightly cooler,636
Verona Beach State Park,Campground on the shore of Oneida Lake with sites near the lakeshore.,NY,state,lake,"43.1767,-75.7293",,-7.755299999999995,slightly cooler,403
Oneida Shores County Park,County park directly on Oneida Lake's southern shore with lakefront campsites.,NY,local,lake,"43.2275,-76.1124",,-7.846739999999999,slightly cooler,403
